trabalhoCompletoEmCongresso	Neide Aparecida Mariano	2012		Comportamento eletroquímico do aço inoxidável super duplex UNS S32520 solubilizado e envelhecido	VII Congresso Nacional de Engenharia Mecânica ? CONEM	VALERIANO, L. C. ; CORREA, E. O. ; CORREA, E. O. ; Mariano, N.A. ; Robin, A. ; CHAVES, R. R. ; Tommaselli, M. A. G.		
trabalhoCompletoEmCongresso	Neide Aparecida Mariano	2012		Influência dos tratamentos térmicos de solubilização e de envelhecimento na microestrutura do aço inoxidável super duplex UNS S32520	67º Congresso da ABM	VALERIANO, L. C. ; Corrêa, E.O. ; MARIANO, N. A. ; MAGNABOSCO, R.		
trabalhoCompletoEmCongresso	Neide Aparecida Mariano	2012		Estudo da Cinética das Transformações de Fases de aço Inoxidável Duplex	XX Congresso Brasileiro de Engenharia e Ciência dos Materiais (CBECIMAT)	CRONEMBERGER, M. E. R. ; MARIANO, N. A. ; RAMOS, E. C. T. ; Mendonça, R. ; MELO, M. L. N. M.		
trabalhoCompletoEmCongresso	Neide Aparecida Mariano	2012		Investigação da influência do tratamento térmico em aços inoxidáveis martensíticos	20º CONGRESSO BRASILEIRO DE ENGENHARIA E CIÊNCIA DOS MATERIAIS	Mendonça, R. ; CRONEMBERGER, M. E. R. ; GALDINO, J.C.A ; SANTOS, M.T ; TOMMASELLI, Maria Aparecida Garcia ; MARIANO, N. A.		
trabalhoCompletoEmCongresso	Neide Aparecida Mariano	2012		ESTUDO DA CORROSÃO DE UM AÇO INOXIDÁVEL APÓS O REVENIMENTO	20º CONGRESSO BRASILEIRO DE ENGENHARIA E CIÊNCIA DOS MATERIAIS	MARIANO, N. A.; Aquino, F.V. ; Mendonça, R. ; CRONEMBERGER, M. E. R. ; FRANCISCO, I. M. M.		
trabalhoCompletoEmCongresso	Neide Aparecida Mariano	2012		RECOBRIMENTO DA HIDROXIAPATITA EM LIGAS METÁLICAS PARA APLICAÇÕES EM IMPLANTES	20º CONGRESSO BRASILEIRO DE ENGENHARIA E CIÊNCIA DOS MATERIAIS	COELHO, M. F. C. ; MARIANO, N. A. ; MAESTRELL, S. C. ; Mendonça, R. ; Marinho, D.H.C. ; RIGO, Eliana C S		
trabalhoCompletoEmCongresso	Neide Aparecida Mariano	2012		RECUPERAÇÃO DE URÂNIO E DE TERRAS RARAS DO RESÍDUO GERADO DA DRENAGEM ÁCIDA	20º CONGRESSO BRASILEIRO DE ENGENHARIA E CIÊNCIA DOS MATERIAIS,	LIMA, P. ; MARIANO, N. A. ; RAMOS, E. C. T. ; Mendonça, R. ; FUKUMA, H. T.		
trabalhoCompletoEmCongresso	Neide Aparecida Mariano	2012		BENEFÍCIOS DA UTILIZAÇÃO DE CINZAS RESIDUAIS GERADAS NA CADEIA DE PRODUÇÃO DO SETOR SUCROALCOOLEIRO DE MATO GROSSO DO SUL NA PRODUÇÃO DE MICROCONCRETO	20º CONGRESSO BRASILEIRO DE ENGENHARIA E CIÊNCIA DOS MATERIAIS	TOMMASELLI, Maria Aparecida Garcia ; LIMA, A. V. ; LENINE, A. A. ; ZANFOLIM, A. A. ; MARIANO, N. A.		
trabalhoCompletoEmCongresso	Neide Aparecida Mariano	2012		CARACTERIZAÇÃO DE MASSAS ASFÁLTICAS FORMULADAS A PARTIR DE EQUAÇÕES DE EMPACOTAMENTO	20º CONGRESSO BRASILEIRO DE ENGENHARIA E CIÊNCIA DOS MATERIAIS	MAESTRELL, S. C. ; Junqueira, A.D ; Ferreira, A.S ; Gonçalves, F.O ; Vry, B,F ; Quaglio, O. A ; MARIANO, N. A.		
trabalhoCompletoEmCongresso	Neide Aparecida Mariano	2012		HIDROGÉIS À BASE DE QUITOSANA E GLICEROL FOSFATO PARA REGENERAÇÃO DE TECIDO OSTEOCONDRAL.. In: 7 Congresso Latino Americano de Órgãos Artificiais e Biomateriais COLAOB 2012, 2012, natal. Campos, M. G. N. 	7 Congresso Latino Americano de Órgãos Artificiais e Biomateriais COLAOB 2012	PEREIRA, R. M. ; OLIVEIRA, F. A. ; MARTINS, E. A. N. ; MARIANO, N.A. ; MEI, L. H. I. ; CAMPOS, M. G. N.		
trabalhoCompletoEmCongresso	Neide Aparecida Mariano	2012		Otimização do processo ensino-aprendizagem em cursos de engenharia através da construção e avaliação de pontes de macarrão	8vo Congreso Internacional de Educacon Superior	MAESTRELL, S. C. ; MARIANO, N.A.		
trabalhoCompletoEmCongresso	Neide Aparecida Mariano	2011		COMPORTAMENTO DE CORROSÃO DE AÇOS INOXIDÁVEIS DÚPLEX FUNDIDOS, EM ÁGUA DO MAR SINTÉTICA	6th BRAZILIAN CONFERENCE ON MANUFACTURING ENGINEERING	BATISTA, S. R. F. ; KURI, Sebastião Elias ; MARIANO, N. A.		
trabalhoCompletoEmCongresso	Neide Aparecida Mariano	2010		Avaliação da Soldagem pelo processo MIG em Aço Inoxidável Martensítico	19o Congresso Brasileiro de Engenharia e Ciência dos Materiais ? CBECiMat	M.A. Fernades ; MARIANO, N. A.		
trabalhoCompletoEmCongresso	Neide Aparecida Mariano	2010		CURVAS DE TRANSFORMAÇÃO ISOTÉRMICA EM AÇOS INOXIDÁVEIS MARTENSÍTICOS	19 CBECiMat - 2010	MARIANO, N. A.; MAESTRELL, S. C. ; DIAS, J. C. ; Aquino, F.V. ; TOMMASELLI, Maria A. G. ; SATOLO, E.		
trabalhoCompletoEmCongresso	Neide Aparecida Mariano	2010		CONSTRUCTION OF A MINI CERAMIC INDUSTRY AS A TOOLIK IN THE PROCESS OF TEACHING AND LEARNING	19 CBECiMat - 2010	MAESTRELL, S. C. ; SATOLO, E. ; MARIANO, N. A.		
trabalhoCompletoEmCongresso	Neide Aparecida Mariano	2008		Avaliação da tenacidade ao impacto do aço inoxidável AISI 304 em juntas soldadas	IX SEMINÁRIO BRASILEIRO DO AÇO INOXIDÁVEL	M.A. Fernades ; M.C.S. ; MARIANO, N. A.		
trabalhoCompletoEmCongresso	Neide Aparecida Mariano	2008		Avaliação da resistência à corrosão por polarização potenciodinâmica e salt spray em aço nitretado	XVIII CONGRESSO BRASILEIRO DE ENGENHARIA E CIÊNCIA DOS MATERIAIS	MARIANO, N. A.; RANALLI, G. A. ; PALLONE NETO, A. S.		
trabalhoCompletoEmCongresso	Neide Aparecida Mariano	2008		Eficiência do Nitrito de Sódio em Solução Saturada de Hidróxido de Sódio Acidificada por Agentes da Chuva Ácida	XVIII CONGRESSO BRASILEIRO DE ENGENHARIA E CIÊNCIA DOS MATERIAIS	TOMMASELLI, Maria A. G. ; MARIANO, N. A. ; RAMIRES, I. ; KURI, Sebastião Elias		
trabalhoCompletoEmCongresso	Neide Aparecida Mariano	2008		Efeitos da têmpera na resistência à corrosão e transformação de fase da liga 13Cr-1,0Ni	XVIII CONGRESSO BRASILEIRO DE ENGENHARIA E CIÊNCIA DOS MATERIAIS	MARIANO, N. A.; Lavelli, C. A. ; Camargo, M.S. ; M.A. Fernades ; TOMMASELLI, Maria Aparecida Garcia		
trabalhoCompletoEmCongresso	Neide Aparecida Mariano	2008		Efeito da temperatura e tempo de austenitização nas transformações de fase da liga 13Cr2Ni0,1C	IX SEMINÁRIO BRASILEIRO DO AÇO INOXIDÁVEL	MARIANO, N. A.; M.A. Fernades ; PEREIRA, V.F. ; IAMARINO, E. B. ; Lavelli, C. A.		
trabalhoCompletoEmCongresso	Neide Aparecida Mariano	2007		Efeito do tratamento térmico na caracterização microestrutural e das propriedades mecânicas de um aço inoxidável martensíticos do tipo 13Cr5Ni0,02%C	VIII SEMINÁRIO Brasileiro do Aço Inoxidável	STROBEL FILHO, Eloy ; LIMA, Alex Pereira de ; MARIANO, N. A.		
trabalhoCompletoEmCongresso	Neide Aparecida Mariano	2007		Caracterização da Temperabilidade e das Curvas de Transformação de fases de Aços Inoxidáveis Martensíticos do Tipo FeCrNi	VIII SEMINÁRIO Brasileiro do Aço Inoxidável	MARIANO, N. A.; LIMA, Alex Pereira de ; RODRIGUES, César A. D. ; LORENZO, Pedro L. Di ; ROLLO, João M. D. A.		
trabalhoCompletoEmCongresso	Neide Aparecida Mariano	2007		Avaliação do aço H10 nitretado em banhos de sal e a plasma	8º Congresso Iberoamericano de Engenharia Mecânica	RANALLI, Gilberto ; PEREIRA, V.F. ; PALLONE NETO, A. S. ; MARIANO, N. A.		
trabalhoCompletoEmCongresso	Neide Aparecida Mariano	2007		Pitting corrosion behaviour and microstructural characterization of 13Cr4Ni stainless steel used in the oil industry	6th Brazilian MRS Meeting (VI Encontro SBPMat)	MARIANO, N. A.; STROBEL FILHO, Eloy ; PEREIRA, V.F. ; PALLONE NETO, A. S. ; TOMMASELLI, Maria Aparecida Garcia		
trabalhoCompletoEmCongresso	Neide Aparecida Mariano	2007		Corrosion characterization of titanium alloys by electrochemical techniques in artificial saliva solution	6th Brazilian MRS Meeting (VI Encontro SBPMat)	MARIANO, N. A.; SALLES, T.H.C. ; OLIVEIRA, R. G. ; RIGO, Eliana C S		
trabalhoCompletoEmCongresso	Neide Aparecida Mariano	2006		Efeito da taxa de resfriamento na resistência à corrosão em aços inoxidáveis martensíticos fundidos	XVII Congresso Brasileiro de Engenharia e Ciência dos Materiais	MARIANO, N. A.; LIMA, Alex Pereira de ; MUROLO, João Paulo ; TOMMASELLI, Maria Aparecida Garcia		
trabalhoCompletoEmCongresso	Neide Aparecida Mariano	2006		O emprego de molibdato de sódio no concreto contra o ataque da chuva ácida	XVII Congresso Brasileiro de Engenharia e Ciência dos Materiais	MARIANO, N. A.; TOMMASELLI, Maria Aparecida Garcia ; KURI, Sebastião Elias		
trabalhoCompletoEmCongresso	Neide Aparecida Mariano	2006		Liga de ferro fundido cinzento não convencional para a fabricação de cilindros secadores	XXVII CONGRESSO BRASILEIRO DE APLICAÇÕES DE VÁCUO NA INDÚSTRIA E NA CIÊNCIA	PIRES, Amandio da Cruz ; MARIANO, N. A.		
trabalhoCompletoEmCongresso	Neide Aparecida Mariano	2006		Efeito do tratamento térmico na caracterização microestrutural e das propriedades mecânicas de um aço inoxidável martensíticos do tipo 13Cr5Ni0,02%C	VIII SEMINÁRIO BRASILEIRO DO AÇO INOXIDÁVEL	STROBEL FILHO, Eloy ; LIMA, Alex Pereira de ; MARIANO, N. A.		
trabalhoCompletoEmCongresso	Neide Aparecida Mariano	2006		Caracterização da Temperabilidade e das Curvas de Transformação de fases de Aços Inoxidáveis Martensíticos do Tipo FeCrNi	VIII SEMINÁRIO BRASILEIRO DO AÇO INOXIDÁVEL	MARIANO, N. A.; LIMA, Alex Pereira de ; RODRIGUES, César A. D. ; LORENZO, Pedro L. Di ; ROLLO, João M. D. A.		
trabalhoCompletoEmCongresso	Neide Aparecida Mariano	2005		Caracterização microestrutural do aço inoxidável martensítico CA15	III CONGRESSO BRASILEIRO DE ENGENHARIA DE FABRICAÇÃO	MARIANO, N. A.; STROBEL FILHO, Eloy ; FONSECA, Jefferson		
trabalhoCompletoEmCongresso	Neide Aparecida Mariano	2005		Effects of the Heat Treatment in the Resistance Corrosion of a Martensitic Stainless Steel CA6NM. In: In: 2nd Mercosur Congress on Chemical Engineering and 4th Mercosur Congress on Process Systems Engineering, 2005, Rio de Janeiro	2nd Mercosur Congress on Chemical Engineering and 4th Mercosur Congress on Process Systems Engineering. Rio de Janeiro: E-papers Serviços Editoriais	STROBEL FILHO, Eloy ; MARIANO, N. A. ; STROBEL, Karen ; DIONÍZIO, Marcos Farias		
trabalhoCompletoEmCongresso	Neide Aparecida Mariano	2005		Nanocrystalline And Amorphous Alloys From Rapid Solidification	2nd Mercosul Congress on Chemical Engineering and 4th Mercosur Congress on Process Systems Engineering	MARIANO, N. A.; KURI, Sebastião Elias		
trabalhoCompletoEmCongresso	Neide Aparecida Mariano	2005		Kinetic model to describe the oxidation of composites through thermogravimetric analysis	Fifth International Latin-American Conference on Powder Technology	MARIANO, N. A.; TOMMASELLI, Maria Aparecida Garcia ; KURI, Sebastião Elias		
trabalhoCompletoEmCongresso	Neide Aparecida Mariano	2004		Otimização da Distribuição de Inclusões Metálicas em Compósitos do Tipo Cerâmica-Metal	48o Congresso Brasileiro de Cerâmica	TOMMASELLI, Maria Aparecida Garcia ; MARIANO, N. A. ; KURI, Sebastião Elias		
trabalhoCompletoEmCongresso	Neide Aparecida Mariano	2004		Corrosion Resistance of a Martensitic Stainless Steel in Seawater	2nd SAE Brasil International Conference on Fatigue	MARIANO, N. A.; STROBEL FILHO, Eloy		
trabalhoCompletoEmCongresso	Neide Aparecida Mariano	2004		Parâmetros Eletroquímicos de Aço Inoxidável em Água do Mar	24 o Conbrascorr - Congresso Brasileiro de Corrosão	MARIANO, N. A.; BERNARDO, A. Z.		
trabalhoCompletoEmCongresso	Neide Aparecida Mariano	2004		Resistência ao pite do aço inoxidável martensítico fundido CA6NM	XVI Congresso Brasileiro de Engenharia e Ciência dos Materiais - CBECIMAT (a ser realizado)	MARIANO, N. A.; STROBEL FILHO, Eloy ; ANSELMO, N. ; KURI, Sebastião Elias		
trabalhoCompletoEmCongresso	Neide Aparecida Mariano	2004		Emprego da Técnica de Espectroscopia de Impedância na avaliação da eficiência de aditivos inibidores de corrosão contra agressores da atmosfera urbana e industrial	XVI CONGRESSO BRASILEIRO DE ENGENHARIA E CIÊNCIA DOS MATERIAIS	TOMMASELLI, Maria Aparecida Garcia ; MARIANO, N. A. ; KURI, Sebastião Elias		
trabalhoCompletoEmCongresso	Neide Aparecida Mariano	2003		Processamento de ligas amorfas FeBSiNbCu	II Congresso Brasileiro de Engenharia de Fabricação	MARIANO, N. A.; KURI, Sebastião Ekias ; MAY, José Eduardo		
trabalhoCompletoEmCongresso	Neide Aparecida Mariano	2003		Niobium particles oxidation kinetics in alumina ceramic matrix composites	Fouth International Latin-American Conference on Powder Technology-PETCH-2003	TOMMASELLI, Maria A. G. ; MARIANO, N. A. ; KURI, Sebastião Elias		
trabalhoCompletoEmCongresso	Neide Aparecida Mariano	2002		Suscetibilidade a corrosão sob tensão por deslocamento constante	XV Congresso Brasileiro de Engenharia e Ciência dos Materiais-CBECIMAT 2002	MARIANO, N. A		
trabalhoCompletoEmCongresso	Neide Aparecida Mariano	2000		Estudo do teor de nióbio no comportamento eletroquímico de fitas amorfas e nanocristalinas de FeBSiNbCu	14o CONGRESSO BRASILEIRO DE ENGENHARIA E CIÊNCIA DOS MATERIAIS	MARIANO, N. A.; KURI, Sebastião Elias		
trabalhoCompletoEmCongresso	Neide Aparecida Mariano	2000		Utilização da alumina para controle da velocidade de volatilização de inibidores de corrosão em fase vapor	44O CONGRESSO BRASILEIRO DE CERÂMICA	MARIANO, N. A.; KURI, Sebastião Ekias ; PANZA, L. P.		
trabalhoCompletoEmCongresso	Neide Aparecida Mariano	1999		Relationship between structural changes and corrosion behavior of finemet alloys with diferent Nb conten-tes	4TH BRAZILIAN SYMPOSIUM ON GLASSES AND RELATED MATERIALS	MARIANO, N. A.; MAY, J. E. ; SOUZA, C. A. C. ; KURI, S. E.		
trabalhoCompletoEmCongresso	Neide Aparecida Mariano	1999		Crystalization and corrosion resistance of amorphous Fe-M-B M=Zr,Nb alloys	4TH BRAZILIAN SYMPOSIUM ON GLASSES AND RELATED	SOUZA, C. A. C. ; OLIVEIRA, M. F. ; MAY, J. E. ; MARIANO, N. A. ; KIMINAMI, C. S. ; KURI, S. E.		
trabalhoCompletoEmCongresso	Neide Aparecida Mariano	1999		Enhanced corrosion resistance of amorphous and nanocrystalline FeNbB alloys	ISMANAM-99	MARIANO, N. A.; SOUZA, C. A. C. ; OLIVEIRA, M. F. ; KURI, S. E.		
trabalhoCompletoEmCongresso	Neide Aparecida Mariano	1999		Oxidacao metalica em composito nanoestruturado do tipo Al2O3-ZrO2-Nb	19o CONGRESSO BRASILEIRO DE CORROSAO	MARIANO, N. A.; KURI, S. E. ; LAUREANO, P. S. ; MAY, J. E.		
trabalhoCompletoEmCongresso	Neide Aparecida Mariano	1999		Corrosao sob tensao em solucoes cloradas de um aco inoxidavel austenitico	19 CONGRESSO BRASILEIRO DE CORROSAO	MARIANO, N. A.; SPINELLI, D.		
trabalhoCompletoEmCongresso	Neide Aparecida Mariano	1999		Oxidation kinetics of micrometric niobium inclusions in a nanometric alumina matrix	NACE-BRAZIL Corrosão99	TOMMASELLI, M. A. G. ; MARIANO, N. A. ; KURI, S. E.		
trabalhoCompletoEmCongresso	Neide Aparecida Mariano	1999		Obtenção de pós nanométricos de alumina por moagem de alta energia e estudo da oxidação com inclusões metálicas micrométricas de níquel	9th Meeting of Portuguese Materials Society	TOMMASELLI, M. A. G. ; MARIANO, N. A. ; KURI, Sebastião Elias		
trabalhoCompletoEmCongresso	Neide Aparecida Mariano	1999		Aplicação da mecânica de fratura no estudo da corrosão sob tensão em aço inoxidável com alto teor de manganês. In: 9O ENCONTRO DA SOCIEDADE PORTUGUESA DE MATERIAIS, 21 a 23 de junho de 1999, Guimarães, Portugal, Materials Proceedings, v.1, p. 1-139 a 1-144, 1999. (doc. 104)	9th Meeting of Portuguese Materials Society,	MARIANO, N. A.; SPINELLI, Dirceu		
trabalhoCompletoEmCongresso	Neide Aparecida Mariano	1998		Utilizacao da tecnica de analise termogravimetrica no estudo da oxidacao de compositos	13o CONGRESSO BRASILEIRO DE ENGENHARIA E CIENCIA DOS MATERIAIS	MARIANO, N. A.; KURI, S. E.		
trabalhoCompletoEmCongresso	Neide Aparecida Mariano	1998		Parametros eletroquimicos de um aco inoxidavel austenitico em solucoes contendo cloretos	13o CONGRESSO BRASILEIRO DE ENGENHARIA E CIENCIA DOS MATERIAIS	MARIANO, N. A.; SPINELLI, D.		
trabalhoCompletoEmCongresso	Neide Aparecida Mariano	1998		Efeito da temperatura na oxi-dacao superficial do aco-ferramenta para trabalho a quente AISI H-13	13o CONGRESSO BRASILEIRO DE ENGENHARIA E CIENCIA DOS MATERIAIS	FRANCO, A. R. J. ; MARIANO, N. A. ; KURI, S. E.		
trabalhoCompletoEmCongresso	Neide Aparecida Mariano	1998		Caracterização e oxidação de pós nanométricos de alumina com inclusão metálica	3o CONGRESSO BRASILEIRO DE ENGENHARIA E CIENCIA DOS MATERIAIS	CHUBA, M. A. G. M. T. ; MARIANO, N. A. ; PALLONE, E. M. J. A. ; KURI, S. E.		
trabalhoCompletoEmCongresso	Neide Aparecida Mariano	1998		Consideracoes sobre a oxidacao metalica em compositos ceramica-metal nanoestruturados	2o CONGRESSO INTERNACIONAL DE TECNOLOGIA METALURGICA E DE MATERIAIS	MARIANO, N. A.; KURI, S. E. ; LOURENÇO, A. E.		
trabalhoCompletoEmCongresso	Neide Aparecida Mariano	1998		Efeito da quantidade e do tipo de inclusao na oxidacao e na distribuicao de particulas metalicas em compositos cerâmica-metal	2o CONGRESSO INTERNACIONAL DE TECNOLOGIA METALURGICA E DE MATERIAIS	MARIANO, N. A.; ALMEIDA, S. G. K. S. E.		
trabalhoCompletoEmCongresso	Neide Aparecida Mariano	1997		High energy ball milling to obtain nanometric composite powders	Acta Microscopica	PALLONE, E. M. J. A. ; MARIANO, N. A. ; KURI, S. E. ; BOTTA, W. J. F.		
trabalhoCompletoEmCongresso	Neide Aparecida Mariano	1996		Corrosao sob tensao em solucoes cloradas de um aco inoxidavel austenitico	II SEMINARIO DE MECANICA DE FRATURA	MARIANO, N. A.; SPINELLI, D.		
trabalhoCompletoEmCongresso	Neide Aparecida Mariano	1996		Comportamento a tracao e microestrutura de um aco do sistema Fe-Cr-Mn-N	12o CONGRESSO BRASILEIRO DE ENGENHARIA E CIENCIA DOS MATERIAIS	MARIANO, N. A.; SPINELLI, D.		
trabalhoCompletoEmCongresso	Neide Aparecida Mariano	1993		Caracterizacao microestrutural do aco inoxidavel austenitico: Cr-Mn-N sensitizado	XIV COLOQUIO DA SOCIEDADE BRASILEIRA DE MICROSCOPIA ELETRONICA	MARIANO, N. A.; SPINELLI, D.		
trabalhoCompletoEmCongresso	Neide Aparecida Mariano	1992		Solucoes solidas de hidrogenio em ligas binarias Nb-W	CONGRESSO BRASILEIRO DE ENGENHARIA E CIENCIA DOS MATERIAIS	MARIANO, N. A.; SILVA, J. R. G.		
trabalhoCompletoEmCongresso	Neide Aparecida Mariano	1992		Monitoramento do crescimento de trincas utilizando a tecnica de queda de potencial AC	SEMINARIO DE CIENCIAS EXATAS E ENGENHARIAS	MARIANO, N. A.; VAREDA, L. V. ; SPINELLI, D.		
trabalhoCompletoEmCongresso	Neide Aparecida Mariano	1992		Efeito da adição do tungstênio nas soluções sólidas de hidrogênio em ligas binarias com niobio	SEMINARIO DE CIENCIAS EXATAS E ENGENHARIAS	MARIANO, N. A.; SILVA, J. R. G.		
trabalhoCompletoEmCongresso	Neide Aparecida Mariano	1992		Monitoramento do crescimento de trincas utilizando a técnica de queda de potencial AC	CONGRESSO DE PÓS-GRADUAÇÃO EM CIÊNCIA E ENGENHARIA	MARIANO, N. A.; VAREDA, L. V. ; SPINELLI, Dirceu		
resumoExpandidoEmCongresso	Neide Aparecida Mariano	2013	Structural evaluation of Ti-Fe-Si-B alloys produced by high-energy ball milling and sintering	PTECH 2013: Ninth International Latin-American Conference on Powder Tech Latin-American Conference on Powder Technology, 2013, Jordão Campos. PTECH 2013: Ninth International Latin-American Conference on Powder Tech Latin-American Conference on Powder Technology	Pereira, W. L ; Bertoli, I. R. ; Franzé, J. A. ; RAMOS, A. S ; MARIANO, N.A. ; ANGELO, C. ; RAMOS, Erika C		
resumoExpandidoEmCongresso	Neide Aparecida Mariano	2012	Structural Evaluation Of Mechanically Alloyed And Hot-Pressed Ti-2Nb-22SI-11B And Ti-6Nb-22Si-11B Alloys	CONFERENCE ON METASTABLE AND NANOSTRUCTURED MATERIALS, NANOMAT, 2012, são carlos. CONFERENCE ON METASTABLE AND NANOSTRUCTURED MATERIALS, NANOMAT	ZANARDO, A. C. ; Campos, M.G.N. ; ALKMIN, L. B. ; Nunes, C. A. ; MARIANO, N. A. ; Ramos, A.S.		
resumoExpandidoEmCongresso	Neide Aparecida Mariano	2012	EFEITO DO TRATAMENTO TÉRMICO NA RESISTÊNCIA À CORROSÃO DA LIGA 13Cr4Ni0,02C	Seminário de Iniciação Científica da UNIFAL-MG, 2012, poços de caldas. Seminário de Iniciação Científica da UNIFAL-MG	Aquino, F.V. ; MARIANO, N. A. ; Santos, M.T. ; Galdino, J.C.A.D. ; Marinho, D.H.C.		
resumoExpandidoEmCongresso	Neide Aparecida Mariano	2010	Microstructural evaluation and effects of austenite resulting from tempering of 13Cr4Ni martensitic steel weld metals	Sociedade Brasileira de Pesquisa em Materiais - SBPMAT-2010, 2010, Ouro preto. Sociedade Brasileira de Pesquisa em Materiais - SBPMAT-2010	M.A. Fernades ; MARIANO, N. A.		
resumoExpandidoEmCongresso	Neide Aparecida Mariano	2009	Effect of retained austenite resulting from tempering of supermartensitics stainless steel weld	11th International Conference on Advanced Materials, ICAM, 2009, Rio de Janeiro. 11th International Conference on Advanced Materials, ICAM 2009	M.A. Fernades ; MARIANO, N. A.		
resumoExpandidoEmCongresso	Neide Aparecida Mariano	2009	Annealing behavior of the AISI 430 ferritic stainless steel obtained by directional solidification	11th International Conference on Advanced Materials, ICAM 2009, 2009. 11th International Conference on Advanced Materials	MELO, M. L. N. M. ; Guimaraes, B. C. ; Hayama , A. O. F ; MARIANO, N. A.		
resumoExpandidoEmCongresso	Neide Aparecida Mariano	2008	Effect of plasma nitriding and nitrocarburizing in corrosion and wear resistance.. In: VII ENCONTRO SBPMat, 2008, 2008, Guaruja	VII ENCONTRO SBPMat, 2008	RANALLI, G. A. ; PALLONE NETO, A. S. ; OLIVEIRA, R. G. ; GALENDE, M. ; MARIANO, N. A.		
resumoExpandidoEmCongresso	Neide Aparecida Mariano	2008	Corrosion Characterization of Titanium Alloys by Electrochemical Techniques in Artificial Saliva and SBF Solution	BIOCERAMICS 21, 2008, Búzios. BIOCERAMICS 21	MARIANO, N. A.; OLIVEIRA, R. G. ; IAMARINO, E. B. ; RIGO, Eliana C S		
resumoExpandidoEmCongresso	Neide Aparecida Mariano	2006	Efeito do recobrimento de hidroxiapatita em titânio comercialmente puro na resistência à corrosão	XXVII CONGRESSO BRASILEIRO DE APLICAÇÕES DE VÁCUO NA INDÚSTRIA E NA CIÊNCIA, CBRAVIC, 2006, tatiba, SP. XXVII CONGRESSO BRASILEIRO DE APLICAÇÕES DE VÁCUO NA INDÚSTRIA E NA CIÊNCIA, CBRAVIC. Itatiba: Visual ID/Brasil Dream Tour	LIMA, Alex Pereira de ; MUROLO, João Paulo ; RIGO, Eliana C S ; MARIANO, N. A.		
resumoExpandidoEmCongresso	Neide Aparecida Mariano	2006	Pitting Corrosion of Martensitic Stainless Steel	V Encontro da Sociedade Brasileira de Pesquisas em Materiais, SBPMat, 2006, Florianópolis. V Encontro da Sociedade Brasileira de Pesquisas em Materiais, SBPMat,	MARIANO, N. A.; STROBEL FILHO, Eloy ; MUROLO, João Paulo ; PEREIRA, V.F.		
resumoExpandidoEmCongresso	Neide Aparecida Mariano	2005	Admixtures effect in concrete on the steel surface microstrucutre	XX CONGRESSO DA SOCIEDADE BRASILEIRA DE MICROSCOPIA E MICROANÁLISE, CSBMM, 2005, Àguas de Lindoia. XX CONGRESSO DA SOCIEDADE BRASILEIRA DE MICROSCOPIA E MICROANÁLISE, CSBMM	TOMMASELLI, Maria Aparecida Garcia ; MARIANO, N. A. ; KURI, Sebastião Elias		
resumoExpandidoEmCongresso	Neide Aparecida Mariano	2004	Estudo do Comportamento do Aço CA6NM em Ambientes de Trabalho com Variação da Concentração de Íons de Cloro	X ENCONTRO DE INICIAÇÃO CIENTÍFICA e III Encontro de Pós-Graduação Stricto Sensu, 2004, Itatiba. X ENCONTRO DE INICIAÇÃO CIENTÍFICA e III Encontro de Pós-Graduação Stricto Sensu. Itatiba: Universidade São Francisco	STROBEL FILHO, Eloy ; MARIANO, N. A.		
resumoExpandidoEmCongresso	Neide Aparecida Mariano	2004	Polarização potenciodinâmica cíclica na determinação da resistência a corrosão	X ENCONTRO DE INICIAÇÃO CIENTÍFICA e III Encontro de Pós-Graduação Stricto Sensu, 2004	BERNARDO, A. Z. ; MARIANO, N. A.		
resumoExpandidoEmCongresso	Neide Aparecida Mariano	2003	Structural analysis of a cast martensitic stainless steel	XIX Congresso da Sociedade Brasileira de Microscopia e Microanálise, 2003, Caxambu. XIX Congresso da Sociedade Brasileira de Microscopia e Microanálise	MARIANO, N. A.; BAGNATO, O. R. ; SERAPHIM, R. M.		
artigoEmPeriodico	Rafaela Cristina Sanfelice	2024		http://dx.doi.org/10.1007/s00289-023-04904-4	Comparison of the acyclovir release carried in chitosan-based microstructured systems	POLYMER BULLETIN	DA SILVA, BRUNO BATISTA ; MENEZES, JORGE EDUARDO ; DA COSTA, MARDOQUEU MARTINS ; DOS SANTOS, LAURITA ; SANFELICE, RAFAELA CRISTINA ; PAVINATTO, ADRIANA	A3	
artigoEmPeriodico	Rafaela Cristina Sanfelice	2024		http://dx.doi.org/10.1007/s00289-024-05619-w	Probing the effects of chitosan-based membranes with different molecular weights on their biocompatibility and antimicrobial activity	POLYMER BULLETIN	MACEDO, JULIANA BEZERRA ; MACEDO, DANIELA BEZERRA ; MARTIGNAGO, CINTIA CRISTINA SANTI ; RENNO, ANA CLAUDIA MUNIZ ; SANFELICE, RAFAELA CRISTINA ; TIM, CARLA ROBERTA ; ASSIS, LÍVIA ; PAVINATTO, ADRIANA	A3	
artigoEmPeriodico	Rafaela Cristina Sanfelice	2023		http://dx.doi.org/10.1016/j.ijbiomac.2023.127425	Chitosan and chitosan/turmeric-based membranes for wound healing: Production, characterization and application	INTERNATIONAL JOURNAL OF BIOLOGICAL MACROMOLECULES	PACHECO, KAROLINE M.L. ; TORRES, BRUNO B.M. ; Sanfelice, Rafaela C. ; DA COSTA, MARDOQUEU M. ; ASSIS, LÍVIA ; MARQUES, ROSEMARIE BRANDIM ; FILHO, ANTÔNIO LUIZ MARTINS MAIA ; TIM, CARLA R. ; PAVINATTO, ADRIANA	A1	
artigoEmPeriodico	Rafaela Cristina Sanfelice	2023		http://dx.doi.org/10.48130/FMR-2023-0026	Shelf life and sensory analysis comparison of alginate and chitosan edible coating incorporating avocado extract applied to minimally processed apples	Food Materials Research	RIBEIRO, ADRIELLE APARECIDA PAULISTA ; SANFELICE, RAFAELA CRISTINA ; MALPASS, GEOFFROY ROGER POINTER ; OKURA, MÔNICA HITOMI ; MALPASS, ANA CLAUDIA GRANATO	Qualis nao identificado	FOOD MATERIALS RESEARCH
artigoEmPeriodico	Rafaela Cristina Sanfelice	2022		http://dx.doi.org/10.21577/0100-4042.20170867	ATIVIDADE ANTIMICROBIANA DE QUITOSANAS E SEUS DERIVADOS: INFLUÊNCIA DAS CARACTERÍSTICAS ESTRUTURAIS	QUÍMICA NOVA (ONLINE)	MACEDO, JULIANA ; SANFELICE, RAFAELA ; MERCANTE, LUIZA ; SANTOS, DANILO ; HABITZREUTER, FILIPE ; CAMPANA-FILHO, SÉRGIO ; PAVINATTO, ADRIANA	A4	
