artigoEmPeriodico	Marcelo Gonçalves Vivas	2019		http://dx.doi.org/10.1021/acs.jpca.8b10984	Absolute Nonlinear Refractive Index Spectra Determination of Organic Molecules in Solutions	JOURNAL OF PHYSICAL CHEMISTRY A	MELHADO, MARLON DOS SANTOS ; BARBANO, EMERSON CRISTIANO ; VIVAS, MARCELO GONÇALVES ; ZILIO, SÉRGIO CARLOS ; MISOGUTI, LINO	A2	JOURNAL OF PHYSICAL CHEMISTRY B
artigoEmPeriodico	Marcelo Gonçalves Vivas	2019		http://dx.doi.org/10.1021/acs.jpclett.9b00518	Intramolecular Cooperative and Anti-Cooperative Effect on the Two-Photon Absorption Cross Section in Triphenylamine Derivatives	Journal of Physical Chemistry Letters	FONSECA, RUBEN D. ; Vivas, Marcelo G. ; SILVA, DANIEL LUIZ ; EUCAT, GWENAELLE ; BRETONNIÈRE, YANN ; ANDRAUD, CHANTAL ; Mendonca, Cleber R. ; DE BONI, Leonardo	A1	
artigoEmPeriodico	Marcelo Gonçalves Vivas	2018		http://dx.doi.org/10.1166/jnn.2018.13932	Effect of Mercaptosuccinic Acid Stabilizer Agent on the Optical Properties of Colloidal CdTe Quantum Dots	JOURNAL OF NANOSCIENCE AND NANOTECHNOLOGY	SOUSA, J. C. L ; VIVAS, M. G ; VALE, B. R. C ; FERRARI, J. L ; SCHIAVON, D M. A	B2	
artigoEmPeriodico	Marcelo Gonçalves Vivas	2018		http://dx.doi.org/10.1021/acs.jpcc.7b05829	First-Order Hyperpolarizability of Triphenylamine Derivatives Containing Cyanopyridine: Molecular Branching Effect	Journal of Physical Chemistry C	FONSECA, RUBEN D. ; Vivas, Marcelo G. ; SILVA, DANIEL LUIZ ; EUCAT, GWENNAELLE ; BRETONNIÈRE, YANN ; ANDRAUD, CHANTAL ; DE BONI, Leonardo ; MENDONÇA, CLEBER R.	A1	
artigoEmPeriodico	Marcelo Gonçalves Vivas	2018		http://dx.doi.org/10.21577/0103-5053.20180128	Synthesis and Optical Properties of Water-Soluble CdTe:Zn2+ Quantum Dots Prepared by the One-Pot Approach	JOURNAL OF THE BRAZILIAN CHEMICAL SOCIETY,	SOUSA, JOSÉ ; VIVAS, MARCELO ; FERRARI, JEFFERSON ; SCHIAVON, MARCO	A2	JOURNAL OF THE BRAZILIAN CHEMICAL SOCIETY
artigoEmPeriodico	Marcelo Gonçalves Vivas	2018		http://dx.doi.org/10.1016/j.optmat.2018.10.023	Femtosecond two-photon absorption spectroscopy of copper indium sulfide quantum dots: A structure-optical properties relationship	OPTICAL MATERIALS	DOS REIS, GEORGE B. ; RODRIGUEZ, RUBEN D.F. ; DOS SANTOS, CALINK I.L. ; GONTIJO, LEIRIANA A.P. ; SCHIAVON, MARCO A. ; DE BONI, Leonardo ; Mendonca, Cleber R. ; Vivas, Marcelo G.	A3	
artigoEmPeriodico	Marcelo Gonçalves Vivas	2017		http://dx.doi.org/10.1021/acs.jpcc.6b06366	Revealing the Dynamic of Excited State Proton Transfer of a π-Conjugated Salicylidene Compound: An Experimental and Theoretical Study. Journal of Physical Chemistry	C	Vivas, M. G.; GERMINO, J. C. ; BARBOZA, C. A. ; SIMONI, DEBORAH DE A. ; VAZQUEZ, P. A. M. ; De BONI, L. ; ATVARS, T. D. Z. ; Mendonça, C. R.	Qualis nao identificado	C
artigoEmPeriodico	Marcelo Gonçalves Vivas	2017		http://dx.doi.org/10.3390/ma10050512	Femtosecond Two-Photon Absorption Spectroscopy of Poly(fluorene) Derivatives Containing Benzoselenadiazole and Benzothiadiazole	Materials	GONÇALVES VIVAS, MARCELO; DARIO FONSECA, RUBEN ; DE PAULA SIQUEIRA, JONATHAS ; RENATO MENDONÇA, CLEBER ; RODRIGUES, PAULA ; DE BONI, Leonardo	A3	
artigoEmPeriodico	Marcelo Gonçalves Vivas	2017		http://dx.doi.org/10.3390/ma10040363	Observation of Distinct Two-Photon Transition Channels in CdTe Quantum Dots in a Regime of Very Strong Confinement	Materials	GONÇALVES VIVAS, MARCELO; LEANDRO DE SOUSA, JOSÉ ; DE BONI, Leonardo ; SCHIAVON, MARCO ; MENDONCA, CLEBER	A3	
artigoEmPeriodico	Marcelo Gonçalves Vivas	2016		http://dx.doi.org/10.1021/acs.jpcc.5b12042	Excited-State and Two-Photon Absorption in Salicylidene Molecules: The Role of Zn(II) Planarization. Journal of Physical Chemistry	C	Vivas, Marcelo G.; GERMINO, JOSÉ CARLOS ; BARBOZA, CRISTINA A. ; VAZQUEZ, PEDRO A. M. ; DE BONI, Leonardo ; ATVARS, TERESA D. Z. ; MENDONÇA, CLEBER R.	Qualis nao identificado	C
artigoEmPeriodico	Marcelo Gonçalves Vivas	2016		http://dx.doi.org/10.1142/S1088424616500048	Studying the intersystem crossing rate and triplet quantum yield of -substituted porphyrins by means of pulse train fluorescence technique	Journal of Porphyrins and Phthalocyanines	BEZERA DE SOUZA, TIAGO GUALBERTO ; VIVAS, MARCELO GONÇALVES ; MENDONÇA, CLEBER RENATO ; PLUNKETT, SHANE ; FILATOV, MIKHAIL A. ; SENGE, MATHIAS O. ; DE BONI, Leonardo	B1	
artigoEmPeriodico	Marcelo Gonçalves Vivas	2015		http://dx.doi.org/10.1063/1.4906893	Experimental and theoretical investigation of the first-order hyperpolarizability of a class of triarylamine derivatives	The Journal of Chemical Physics	Silva, Daniel L. ; FONSECA, RUBEN D. ; Vivas, Marcelo G. ; ISHOW, E. ; CANUTO, SYLVIO ; Mendonca, Cleber R. ; DE BONI, Leonardo	A2	
artigoEmPeriodico	Marcelo Gonçalves Vivas	2015		http://dx.doi.org/10.1021/acs.jpcc.5b02386	Interpreting the First-Order Electronic Hyperpolarizability for a Series of Octupolar Push-Pull Triarylamine Molecules Containing Trifluoromethyl. Journal of Physical Chemistry. C	(Online)	Vivas, Marcelo G.; Silva, Daniel L. ; RODRIGUEZ, RUBEN D. F. ; CANUTO, SYLVIO ; MALINGE, JÉRÉMY ; ISHOW, ELÉNA ; Mendonca, Cleber R. ; DE BONI, Leonardo	Qualis nao identificado	
artigoEmPeriodico	Marcelo Gonçalves Vivas	2015		http://dx.doi.org/10.1039/c5ra10719a	Investigation of the Nonlinear Absorption Spectrum of All-Trans Retinoic Acid by Using the Steady and Transient Two-Photon Absorption Spectroscopy	RSC Advances: an international journal to further the chemical sciences	VIVAS, MARCELO GONCALVES; SIQUEIRA, JONATHAS ; SILVA, DANIEL ; BONI, LEONARDO DE ; MENDONÇA, CLEBER R	A2	
artigoEmPeriodico	Marcelo Gonçalves Vivas	2014		http://dx.doi.org/10.1016/j.dyepig.2013.10.026	Investigation of ground and excited state photophysical properties of gadolinium phthalocyanine	Dyes and Pigments	Vivas, Marcelo G.; DE BONI, Leonardo ; GAFFO, LUCIANA ; Mendonca, Cleber R.	A1	
artigoEmPeriodico	Marcelo Gonçalves Vivas	2014		http://dx.doi.org/10.1038/srep04447	Molecular Structure - Optical Property Relationships for a Series of Non-Centrosymmetric Two-photon Absorbing Push-Pull Triarylamine Molecules	Scientific Reports	Vivas, Marcelo G.; Silva, Daniel L. ; MALINGE, JÉRÉMY ; BOUJTITA, MOHAMMED ; ZALE'NY, ROBERT ; BARTKOWIAK, WOJCIECH ; ÅGREN, HANS ; CANUTO, SYLVIO ; DE BONI, Leonardo ; ISHOW, ELÉNA ; Mendonca, Cleber R.	A1	
artigoEmPeriodico	Marcelo Gonçalves Vivas	2014		http://dx.doi.org/10.1039/c4ra05979d	Determination of particle size distribution of water-soluble CdTe quantum dots by optical spectroscopy	RSC Advances: an international journal to further the chemical sciences	SOUSA, J. C. L. ; Vivas, M. G. ; FERRARI, J. L. ; MENDONCA, C. R. ; SCHIAVON, M. A.	A2	
artigoEmPeriodico	Marcelo Gonçalves Vivas	2014		http://dx.doi.org/10.1021/jp503318u	Understanding the Two-Photon Absorption Spectrum of PE2 Platinum Acetylide Complex	The Journal of Physical Chemistry A	Vivas, Marcelo G.; DE BONI, Leonardo ; Cooper, Thomas M. ; Mendonca, Cleber R.	A3	THE JOURNAL OF PHYSICAL CHEMISTRY. A
artigoEmPeriodico	Marcelo Gonçalves Vivas	2014		http://dx.doi.org/10.1021/ph4000357	Interpreting Strong Two-photon Absorption of PE3 Platinum Acetylide Complex: Double Resonance and Excited State Absorption	ACS PHOTONICS	VIVAS, MARCELO G; DE BONI, Leonardo ; Cooper, Thomas M. ; Mendonca, Cleber R.	A1	
artigoEmPeriodico	Marcelo Gonçalves Vivas	2013		http://dx.doi.org/10.1021/jz4007004	Revealing the Electronic and Molecular Structure of Randomly Oriented Molecules by Polarized Two-Photon Spectroscopy	Journal of Physical Chemistry Letters	Vivas, Marcelo G.; Silva, Daniel L. ; DE BONI, Leonardo ; BRETONNIERE, YANN ; ANDRAUD, CHANTAL ; LAIBE-DARBOUR, FLORENCE ; MULATIER, J.-C. ; ZALE'NY, ROBERT ; BARTKOWIAK, WOJCIECH ; CANUTO, SYLVIO ; Mendonca, Cleber R.	A1	
artigoEmPeriodico	Marcelo Gonçalves Vivas	2013		http://dx.doi.org/10.1021/jp400956k	Two-Photon Absorption of ZnS Quantum Dots: Interpreting the Nonlinear Spectrum. Journal of Physical Chemistry	C	Vivas, Marcelo G.; CURY, JOHN F. ; SCHIAVON, MARCO A. ; Mendonca, Cleber R.	Qualis nao identificado	C
artigoEmPeriodico	Marcelo Gonçalves Vivas	2013		http://dx.doi.org/10.1021/jp311065n	Two-Photon Circular-Linear Dichroism of Perylene in Solution: A Theoretical-Experimental Study. Journal of Physical Chemistry	B	Vivas, Marcelo G.; DIAZ, CARLOS ; ECHEVARRIA, LORENZO ; Mendonca, Cleber R. ; HERNÁNDEZ, FLORENCIO E. ; DE BONI, Leonardo	Qualis nao identificado	B
artigoEmPeriodico	Marcelo Gonçalves Vivas	2012		http://dx.doi.org/10.1364/OE.20.000518	Femtosecond laser induced synthesis of Au nanoparticles mediated by chitosan	Optics Express	FERREIRA, P. H. D. ; M. G. Vivas ; De Boni, L. ; dos Santos, D. S. ; Balogh, D. T. ; MISOGUTI, L. ; MENDONCA, C. R.	A2	
artigoEmPeriodico	Marcelo Gonçalves Vivas	2012		http://dx.doi.org/10.1016/j.cplett.2012.02.028	Study of singlet excited state absorption spectrum of lutetium bisphthalocyanine using the femtosecond Z-scan technique	Chemical Physics Letters (Print)	Vivas, Marcelo G.; Fernandes, Edson G.R. ; Rodríguez-Méndez, María Luz ; Mendonca, Cleber R.	A3	
artigoEmPeriodico	Marcelo Gonçalves Vivas	2012		http://dx.doi.org/10.1364/OE.20.018600	Polarization effect on the two-photon absorption of a chiral compound	Optics Express	Vivas, M. G.; De Boni, L. ; Bretonniere, Y. ; Andraud, C. ; MENDONCA, C. R.	A2	
artigoEmPeriodico	Marcelo Gonçalves Vivas	2012		http://dx.doi.org/10.1021/jp308161x	Effect of Solvent-Induced Coil to Helix Conformational Change on the Two-Photon Absorption Spectrum of Poly(3,6-phenanthrene). The Journal of Physical Chemistry	B (1997 : Online)	Vivas, M. G.; KOECKELBERGHS, GUY ; MENDONCA, C. R.	Qualis nao identificado	B
artigoEmPeriodico	Marcelo Gonçalves Vivas	2012		http://dx.doi.org/10.1021/jp310731t	Experimental and Theoretical Study on the One- and Two-Photon Absorption Properties of Novel Organic Molecules Based on Phenylacetylene and Azoaromatic Moieties. The Journal of Physical Chemistry	B (1997 : Online)	Vivas, Marcelo G.; Silva, Daniel L. ; DE BONI, Leonardo ; BRETONNIERE, YANN ; ANDRAUD, CHANTAL ; LAIBE-DARBOUR, FLORENCE ; MULATIER, J.-C. ; ZALE'NY, ROBERT ; BARTKOWIAK, WOJCIECH ; CANUTO, SYLVIO ; Mendonca, Cleber R.	Qualis nao identificado	B
artigoEmPeriodico	Marcelo Gonçalves Vivas	2012		http://dx.doi.org/10.1021/jp303789s	Temperature Effect on the Two-Photon Absorption Spectrum of All- trans -β-carotene. The Journal of Physical Chemistry	A	Vivas, M. G.; MENDONCA, C. R.	Qualis nao identificado	A
artigoEmPeriodico	Marcelo Gonçalves Vivas	2011		http://dx.doi.org/10.1016/j.optcom.2011.03.022	Nonlinear spectrum effect on the coherent control of molecular systems	Optics Communications (Print)	FERREIRA, P. H. D. ; M. G. Vivas ; SILVA, D. L. ; MISOGUTI, L. ; FENG, K. ; XIU BU ; MENDONCA, C. R.	A3	
artigoEmPeriodico	Marcelo Gonçalves Vivas	2011		http://dx.doi.org/10.1063/1.3590157	Two-photon absorption spectra of carotenoids compounds	Journal of Applied Physics	M. G. Vivas; SILVA, D. L. ; DE BONI, Leonardo ; ZALESNY, R. ; BARTKOWIAK, W. ; MENDONCA, C. R.	A1	
artigoEmPeriodico	Marcelo Gonçalves Vivas	2011		http://dx.doi.org/10.1021/jp203194t	Linear and Nonlinear Optical Properties of the Thiophene/Phenylene-Based Oligomer and Polymer. Journal of Physical Chemistry	B	Vivas, M. G.; NOGUEIRA, S. L. ; Silva, H. Santos ; Barbosa Neto, N. M. ; MARLETTA, A. ; SEREIN-SPIRAU, F. ; LOIS, S. ; JARROSSON, T. ; De Boni, L. ; SILVA, R. A. ; MENDONCA, C. R.	Qualis nao identificado	B
artigoEmPeriodico	Marcelo Gonçalves Vivas	2011		http://dx.doi.org/10.1364/OME.1.000700	Broadband three-photon absorption spectra of platinum acetylide complexes	Optical Materials Express	Vivas, Marcelo G.; Piovesan, Erick ; Silva, Daniel L. ; Cooper, Thomas M. ; DE BONI, Leonardo ; Mendonca, Cleber R.	A2	
artigoEmPeriodico	Marcelo Gonçalves Vivas	2010		http://dx.doi.org/10.1364/OE.18.009628	Nonlinear spectra of ZnO: reverse saturable, two- and three-photon absorption	Optics Express	M. G. Vivas; SHIH, T. ; VOSS, T. ; MAZUR, E. ; MENDONCA, C. R.	A2	
artigoEmPeriodico	Marcelo Gonçalves Vivas	2010		http://dx.doi.org/10.1021/jp910010g	Degenerate Two-Photon Absorption in All-Trans Retinal: Nonlinear Spectrum and Theoretical Calculations. The Journal of Physical Chemistry	A	M. G. Vivas; SILVA, D. L. ; MISOGUTI, L. ; ZALESNY, R. ; BARTKOWIAK, W. ; MENDONCA, C. R.	Qualis nao identificado	A
trabalhoCompletoEmCongresso	Marcelo Gonçalves Vivas	2012		Polyglycerol dendrimers bearing rhodamine and Gd3+ as terminal groups: Magneto-optical properties and phototoxicity against tumoral cells	Congresso Latino Americano de Órgãos Artificiais e Biomateriais	MARTINS, T. ; M. G. Vivas ; DE BONI, Leonardo ; MENDONCA, C. R. ; de QUEIROZ, A.A.A.		
resumoExpandidoEmCongresso	Marcelo Gonçalves Vivas	2020	Understanding the photobleaching mechanisms of MEH-PPV	43ª Reunião Anual da SBQ, 2020, Evento online. Understanding the photobleaching mechanisms of MEH-PPV	RALCOSKI, M. L. ; VIVAS, M.G.		
resumoExpandidoEmCongresso	Marcelo Gonçalves Vivas	2019	Two-photon Absorption of GaN and AlxGa1-xN Thin Films	Frontiers in Optics + Laser Science APS/DLS, 2019, Washington, DC United States. Two-photon Absorption of GaN and AlxGa1-xN Thin Films	MANOEL, D. S. ; DIPOLD, J. ; MARTINS, R. R. ; FONSECA, R. D. ; VOSS, T. ; WAAG, A. ; VIVAS, M. G. ; MENDONCA, C. R.		
resumoExpandidoEmCongresso	Marcelo Gonçalves Vivas	2017	Two-Photon Circular-Linear Dichroism on a Binaphtalene-based Polymer	Fronties in Optics, 2017, Washington, DC. Two-Photon Circular-Linear Dichroism on a Binaphtalene-based Polymer	DIPOLD, J. ; KOECKELBERGHS, GUY ; VIVAS, M. G. ; De BONI, L. ; MENDONCA, C. R.		
resumoExpandidoEmCongresso	Marcelo Gonçalves Vivas	2015	Revealing the Dynamic of Excited State Proton Transfer of a Novel π-conjugated Salicylidene Chromophore	Encontro Latino Americano de Fotoquímica e Fotobiologia, 2015, Maresias. Revealing the Dynamic of Excited State Proton Transfer of a Novel π-conjugated Salicylidene Chromophore	VIVAS, M. G.; GERMINO, J. C. ; BARBOSA, C. A. ; De Boni, L. ; ATVARZ, T. D. Z. ; MENDONCA, C. R.		
resumoExpandidoEmCongresso	Marcelo Gonçalves Vivas	2015	Experimental and Theoretical study of effect of the Zn coordination complex on the excited state and two-photon absorption spectra of salicylidene compounds	Encontro Latino Americano de Fotoquímica e Fotobiologia, 2015, Maresias. Experimental and Theoretical study of effect of the Zn coordination complex on the excited state and two-photon absorption spectra of salicylidene compounds	VIVAS, M. G.; GERMINO, J. C. ; BARBOSA, C. A. ; DE BONI, Leonardo ; ATVARZ, T. D. Z. ; MENDONCA, C. R.		
resumoExpandidoEmCongresso	Marcelo Gonçalves Vivas	2015	Investigando processos ópticos não lineares através de medidas ópticas lineares	67 Reunião Anual da SBPC, 2015, São Carlos. Investigando processos ópticos não lineares através de medidas ópticas lineares	SIQUEIRA, A. S. F. ; VIVAS, M. G.		
resumoExpandidoEmCongresso	Marcelo Gonçalves Vivas	2015	Desenvolvimento de um sensor óptico baseado no fenômeno de Ressonância de Plásmon de Superfície	67 Reunião Anual da SBPC, 2015, São Carlos. Desenvolvimento de um sensor óptico baseado no fenômeno de Ressonância de Plásmon de Superfície	OLIVEIRA, A. C. ; VIVAS, MARCELO G		
resumoExpandidoEmCongresso	Marcelo Gonçalves Vivas	2015	Giant Hyper-Rayleigh Scattering Observed in a Class of Chiral Polymers	European Conference on Lasers and Electro-Optics - European Quantum Electronics Conference, 2015, Munich. Giant Hyper-Rayleigh Scattering Observed in a Class of Chiral Polymers	VIVAS, MARCELO G; KOECKELBERGHS, G. ; MENDONÇA, CLEBER R ; DE BONI, Leonardo		
resumoExpandidoEmCongresso	Marcelo Gonçalves Vivas	2015	Revealing the Dynamic of Excited State Proton Transfer of a Novel π-conjugated Salicylidene Chromophore	European Conference on Lasers and Electro-Optics - European Quantum Electronics Conference, 2015, Munich. Revealing the Dynamic of Excited State Proton Transfer of a Novel π-conjugated Salicylidene Chromophore	VIVAS, MARCELO G; GERMINO, J. C. ; BARBOSA, C. A. ; DE BONI, Leonardo ; ATVARZ, T. D. Z. ; MENDONÇA, CLEBER R		
resumoExpandidoEmCongresso	Marcelo Gonçalves Vivas	2014	Determination of Size and Size Distribution of Water-Soluble CdTe Quantum Dots Synthesized by One-Pot Approach	International Conference on Quantum Dots, 2014, Pisa. International Conference on Quantum Dots	SOUZA, J. C. L. ; VIVAS, M. G. ; MENDONCA, C. R. ; FERRARI, J. L. ; SCHIAVON, MARCO A.		
resumoExpandidoEmCongresso	Marcelo Gonçalves Vivas	2013	TiO_2 Assisted Rhodamine B Photodegradation via Multiphotonic Excitation	Frontiers in Optics, 2013	FIGUEREDO, TARCÍSIO R. ; VIVAS, MARCELO ; Mendonca, Cleber R.		
resumoExpandidoEmCongresso	Marcelo Gonçalves Vivas	2013	Two-Photon Circular-Linear Dichroism of Chiral Molecules Based on Phenylacetylene Moieties	Frontiers in Optics, 2013, Orlando. Frontiers in Optics 2013. Washington: OSA	Vivas, Marcelo G.; SILVA, DANIEL ; DE BONI, Leonardo ; CANUTO, SYLVIO ; Mendonca, Cleber R.		
resumoExpandidoEmCongresso	Marcelo Gonçalves Vivas	2012	Effect of Electron Withdrawing Substituents on the two-photon absorption Properties of a Novel Class of Push-Pull Triarylamine Compounds	Latin America Optics and Photonics Conference, 2012	Vivas, Marcelo G.; DE BONI, Leonardo ; MENDONCA, CLEBER ; ISHOW, ELENA		
resumoExpandidoEmCongresso	Marcelo Gonçalves Vivas	2012	Influence of Conformational Change Induced by Solvent on the Two-photon Absorption spectrum of Poly(3,6 phenanthrene)s	Latin America Optics and Photonics Conference, 2012	Vivas, Marcelo G.; KOECKELBERGHS, GUY ; MENDONCA, CLEBER		
resumoExpandidoEmCongresso	Marcelo Gonçalves Vivas	2010	Study of the Two-photon-induced Reduction of Gold Nanoparticles	Frontiers in Optics, 2010, Rochester. Frontiers in Optics 2010/Laser Science XXVI. Washington: OSA	FERREIRA, PAULO HENRIQUE D. ; VIVAS, MARCELO GONÇALVES. ; SIQUEIRA, JONATHAS DE PAULA. ; DE BONI, Leonardo ; MISOGUTI, LINO ; MENDONÇA, CLEBER RENATO.		
resumoExpandidoEmCongresso	Marcelo Gonçalves Vivas	2010	Polarization-Dependent Two-Photon Absorption of ?-Conjugated Molecules	Frontiers in Optics, 2010	Vivas, Marcelo G.; DE BONI, Leonardo ; Mendonca, Cleber R.		
resumoExpandidoEmCongresso	Marcelo Gonçalves Vivas	2010	Temperature Dependence of the Two-photon Absorption of Carotenoids	Latin America Optics and Photonics Conference, 2010, Recife. Latin America Optics and Photonics Conference. Washington: OSA	Vivas, Marcelo G.; Mendonca, Cleber R.		
resumoExpandidoEmCongresso	Marcelo Gonçalves Vivas	2010	Femtosecond Pulse Shaping For Coherent Control Of Gold Nanoparticles Formation	Latin America Optics and Photonics Conference, 2010, Recife. Latin America Optics and Photonics Conference. Washington: OSA	MENDONCA, CLEBER ; FERREIRA, PAULO H. ; SIQUEIRA, JONATHAS ; MISOGUTI, LINO ; Vivas, Marcelo G. ; DOS SANTOS, DAVID S. ; DE BONI, Leonardo		
resumoExpandidoEmCongresso	Marcelo Gonçalves Vivas	2009	Investigation of the Degenerate Two-Photon Absorption Cross-Section in all-trans Retinal: Nonlinear Spectrum and Molecular Structure	International Conference on Advanced Materials, 2009, Rio de janeiro. digital book	M. G. Vivas; D. L. Silva ; Mendonça, C. R.		
resumoExpandidoEmCongresso	Marcelo Gonçalves Vivas	2009	Absorção de dois fótons degenerada de compostos carotenóides: Espectro não linear e cálculos teóricos	XIII Workshop do programa de pós-graduação em física do IFSC, 2009, São Carlos - SP. Abstract book	M. G. Vivas; SILVA, D. L. ; MENDONCA, C. R.		
resumoExpandidoEmCongresso	Marcelo Gonçalves Vivas	2007	Estudo das propriedades Hemocompatíveis do Poliglicerol dendrítico por Ressonância de Plásmon de Superície	10o Sicem, 2007, São Carlos - SP. digital book	GIAROLA, V. M. ; M. G. Vivas ; de QUEIROZ, A.A.A.		
resumoExpandidoEmCongresso	Marcelo Gonçalves Vivas	2006	Study of the blood compatibility of polyglycerol dendrimers by using the surface plasmon resonance sensor	World Polymer Congress - Macro 2006, 2006, Rio de Janeiro. digital book	M. G. Vivas; GIAROLA, V. M. ; de QUEIROZ, A.A.A.		
artigoEmPeriodico	María Elena Leyva González	2024		http://dx.doi.org/10.1109/tdei.2024.3350559	Probing the epoxy insulation of smoothing reactors with graphene ink	IEEE TRANSACTIONS ON DIELECTRICS AND ELECTRICAL INSULATION	DE FARIA, G.H. ; DOS PASSOS ARAÚJO, L.C. ; LOPES, G.P. ; NETO, E.T. WANDERLEY ; LEYVA, M.E. ; DE QUEIROZ, A.A.A.	Qualis nao identificado	IEEE TRANSACTIONS ON DIELECTRICS AND ELECTRICAL INSULATION
artigoEmPeriodico	María Elena Leyva González	2024		http://dx.doi.org/10.1109/tdei.2023.3349256	Electrical Properties of Silver-Silicone Rubber Nanocomposites for High-Voltage Outdoor Insulators	IEEE TRANSACTIONS ON DIELECTRICS AND ELECTRICAL INSULATION	DOS PASSOS ARAÚJO, LÍVIA C. ; LEYVA, MARIA E. ; NETO, ESTÁCIO T.W. ; DE QUEIROZ, ALVARO A.A.	Qualis nao identificado	IEEE TRANSACTIONS ON DIELECTRICS AND ELECTRICAL INSULATION
artigoEmPeriodico	María Elena Leyva González	2023		http://dx.doi.org/10.3390/en16207019	Higher Electrical Conductivity of Functionalized Graphene Oxide Doped with Silver and Copper (II) Ions	Energies	PEREIRA, NELSON GUSTAVO ALVES ; GONZALÉZ, MARIA ELENA LEYVA ; QUEIROZ, ALVARO ANTONIO ALENCAR DE ; OLIVEIRA, ADHIMAR FLÁVIO ; TAVARES WANDERLEY NETO, ESTÁCIO	A2	
artigoEmPeriodico	María Elena Leyva González	2023			Synergistic electrochemical method to prepare graphene oxide/polyaniline nanocomposite	Polimeros-Ciencia e Tecnologia	Eric Pereira ; FREITAS, A. G. F. ; Leyva, Maria Elena ; Adhimar F. Oliveira	A3	POLÍMEROS - CIÊNCIA E TECNOLOGIA
artigoEmPeriodico	María Elena Leyva González	2022		http://dx.doi.org/10.1590/0104-1428.20220025	Poly(vinyl alcohol)/poly(glycerol) dendrimer hydrogel mediated green synthesis of silver nanoparticles	Polímeros: ciência e Tecnologia	MARCONDES, POLLYANA ; ROSAS, GISELA HELOU ; GONZÁLEZ, MARIA ELENA LEYVA ; QUEIROZ, ALVARO ANTONIO ALENCAR DE ; MARQUES, PAULO SERGIO	A3	
artigoEmPeriodico	María Elena Leyva González	2021		http://dx.doi.org/10.1177/08853282211046418	Biophysical properties of electrospun chitosan-grafted poly(lactic acid) nanofibrous scaffolds loaded with chondroitin sulfate and silver nanoparticles	JOURNAL OF BIOMATERIALS APPLICATIONS	JÚNIOR, ALEXANDRE F ; RIBEIRO, CHARLENE A ; Leyva, Maria E ; MARQUES, PAULO S ; SOARES, CARLOS R J ; ALENCAR DE QUEIROZ, ALVARO A	A3	
artigoEmPeriodico	María Elena Leyva González	2020		http://dx.doi.org/10.1109/tmag.2020.2979673	Electric Current Generation from Dendrimer based Magnetofluid Flow in a Toroidal Chamber	IEEE TRANSACTIONS ON MAGNETICS	KASHIWAGI, FABIO N. ; NETO, ESTACIO W. T. ; GONZALEZ, MARIA E. L. ; DE QUEIROZ, ALFREDO A.A.E. ; DE QUEIROZ, ALVARO A. A.	A3	
artigoEmPeriodico	María Elena Leyva González	2020		http://dx.doi.org/10.1590/0104-1428.02020	Electropolymerization of polyaniline nanowires on poly(2-hydroxyethyl methacrylate) coated Platinum electrode	Polímeros: ciência e Tecnologia	MEDEIROS, MARIA FERNANDA XAVIER PINTO ; Leyva, Maria Elena ; QUEIROZ, ALVARO ANTONIO ALENCAR DE ; MARON, LILIAM BECHERAN	A3	
artigoEmPeriodico	María Elena Leyva González	2019			Membranas termossensíveis baseadas em redes poliméricas semi-interpenetrantes de Quitosana e Poli(N-isopropilacrilamida)	RESEARCH, SOCIETY AND DEVELOPMENT	Luana A. S. Braga ; Alexandre F. Júnior ; Maria Elena Leyva ; A. A. A. de Queiroz	C	
artigoEmPeriodico	María Elena Leyva González	2019		http://dx.doi.org/10.1080/09205063.2019.1636351	Biological properties of electrospun cellulose scaffolds from biomass	JOURNAL OF BIOMATERIALS SCIENCE-POLYMER EDITION	FRIEND, DEBORA FERREIRA LAURITO ; LEYVA GONZÁLEZ, MARIA ELENA ; CARABALLO, MIRTA MIR ; ALENCAR DE QUEIROZ, ALVARO ANTONIO	A3	JOURNAL OF BIOMATERIALS SCIENCE. POLYMER EDITION
artigoEmPeriodico	María Elena Leyva González	2018		http://dx.doi.org/10.1007/s00289-018-2398-7	GHz permittivity of carbon black and polyaniline with styrene-butadiene-styrene composites	POLYMER BULLETIN	Rubinger, C. P. L. ; LEYVA, M. E.	A3	
artigoEmPeriodico	María Elena Leyva González	2017		http://dx.doi.org/10.1016/j.msec.2017.07.048	Electrochemical preparation and characterization of PNIPAM-HAp scaffolds for bone tissue engineering	Materials Science & Engineering C-Materials for Biological Applications	Charlene A. Ribeiro ; SURMANI, M. V. ; BRESSIANI, A. H. A. ; BRESSIANI, J. C. ; A. A. A. de Queiroz ; Maria Elena Leyva	Qualis nao identificado	MATERIALS SCIENCE & ENGINEERING C-MATERIALS FOR BIOLOGICAL APPLICATIONS
artigoEmPeriodico	María Elena Leyva González	2017		http://dx.doi.org/10.1007/s10008-017-3798-6	A new low bandgap hybrid polymer film obtained by electropolymerization of 3,4-ethylenedioxythiophene with bis(1,3-dithiole-2-thione-4,5-dithiolate)platinate(II) dianion, PEDOT/[Pt(dmit)2]2−	JOURNAL OF SOLID STATE ELECTROCHEMISTRY	BERNARDO DA CRUZ, ANTONIO GERSON ; Leyva, Maria Elena ; SIMÃO, RENATA ANTOUN	A3	
artigoEmPeriodico	María Elena Leyva González	2014		http://dx.doi.org/10.4322/polimeros.2014.033	Thermoplastic elastomers blends based on linear low density polyethylene, ethylene-1-octene copolymers and ground rubber tire. Polímeros (São Carlos	Online)	ROCHA, MARISA CRISTINA GUIMARÃES ; Leyva, Maria Elena ; OLIVEIRA, MARCIA GOMES	Qualis nao identificado	ONLINE)
artigoEmPeriodico	María Elena Leyva González	2012		http://dx.doi.org/10.1590/S1517-70762012000200002	Estudo da mistura do éter diglicidílico do bisfenol-A com poli(etileno-co-acetato de vinila)-g-poli(metacrilato de metila) por espectroscopia dielétrica e calorimetria exploratória diferencial	Matéria (UFRJ)	LEYVA, M.E.; GARCIA, F.G. ; SOARES, B.G.	B1	
artigoEmPeriodico	María Elena Leyva González	2012		http://dx.doi.org/10.1007/s10853-011-5864-2	Hopping conduction on carbon black/styrene¿butadiene¿styrene composites. Journal of Materials Science (Dordrecht	Online)	Rubinger, C. P. L. ; LEYVA, M. E. ; SOARES, B. G. ; RIBEIRO, G. M. ; Rubinger, R. M.	Qualis nao identificado	ONLINE)
