artigoEmPeriodico	Daniela Sachs	2017		http://dx.doi.org/10.1590/0370-44672017700082	Study of the microstructure and mechanical properties of beta tricalcium phosphate-based composites with alumina addition produced by powder metallurgy	REM - International Engineering Journal	KUFFNER, BRUNA HORTA BASTOS ; FACCI, ANDREIA DITZEL ; Sachs, Daniela ; SILVA, GILBERT	A4	
artigoEmPeriodico	Daniela Sachs	2015		http://dx.doi.org/10.1371/journal.pone.0118356	Lithothamnion muelleri Treatment Ameliorates Inflammatory and Hypernociceptive Responses in Antigen-Induced Arthritis in Mice	Plos One	Costa, Vivian V. ; AMARAL, FLAVIO A. ; Coelho, Fernanda M. ; QUEIROZ-JUNIOR, CELSO M. ; MALAGOLI, BRUNA G. ; GOMES, JOSE HUGO S. ; Lopes, Fernando ; SILVEIRA, KÁTIA D. ; Sachs, Daniela ; Fagundes, Caio T. ; TAVARES, LÍVIA D. ; Pinho, Vanessa ; SILVA, TARCILIA A. ; Teixeira, Mauro M. ; BRAGA, FERNÃO C. ; Souza, Danielle G.	A1	
artigoEmPeriodico	Daniela Sachs	2012		http://dx.doi.org/10.1002/art.33355	NLRP3 inflammasome-mediated neutrophil recruitment and hypernociception depend on leukotriene B4 in a murine model of gout	Arthritis and Rheumatism	Amaral, FlÃ¡vio A. ; Costa, Vivian V. ; Tavares, Livia D. ; Sachs, Daniela ; Coelho, Fernanda M. ; Fagundes, Caio T. ; Soriani, Frederico M. ; Silveira, Tatiana N. ; Cunha, Larissa D. ; Zamboni, Dario S. ; Quesniaux, Valerie ; Peres, Raphael S. ; Cunha, Thiago M. ; Cunha, Fernando Q. ; Ryffel, Bernhard ; Souza, Daniele G. ; Teixeira, Mauro M.	Qualis nao identificado	ARTHRITIS AND RHEUMATISM
artigoEmPeriodico	Daniela Sachs	2012		http://dx.doi.org/10.3389/fimmu.2012.00293	Glycosaminoglycan analogs as a novel anti-inflammatory strategy	Frontiers in Immunology (Online)	SEVERIN, INDIA C. ; SOARES, ADRIANO ; HANTSON, JENNIFER ; TEIXEIRA, MAURO ; Sachs, Daniela ; VALOGNES, DELPHINE ; SCHEER, ALEXANDER ; SCHWARZ, MATTHIAS K. ; WELLS, TIMOTHY N. C. ; PROUDFOOT, AMANDA E. I. ; SHAW, JEFFREY	A2	
artigoEmPeriodico	Daniela Sachs	2011		http://dx.doi.org/10.1111/j.1476-5381.2010.00895.x	Cooperative role of tumour necrosis factor-?, interleukin-1? and neutrophils in a novel behavioural model that concomitantly demonstrates articular inflammation and hypernociception in mice	British Journal of Pharmacology	Sachs, Daniela; Coelho, Fernanda M ; Costa, Vívian V ; Lopes, Fernando ; Pinho, Vanessa ; Amaral, Flávio A ; Silva, Tarcília A ; Teixeira, Antônio L ; Souza, Daniele G ; Teixeira, Mauro M	Qualis nao identificado	BRITISH JOURNAL OF PHARMACOLOGY
artigoEmPeriodico	Daniela Sachs	2010		http://dx.doi.org/10.1073/pnas.0914733107	Morphine peripheral analgesia depends on activation of the PI3K /AKT/nNOS/NO/KATP signaling pathway	Proceedings of the National Academy of Sciences of the United States of America	CUNHA, T. M. ; Roman-Campos, D. ; LOTUFO, C. M. ; Duarte, H. L. ; Souza, G. R. ; Verri, W. A. ; FUNEZ, M. I. ; Dias, Q. M. ; Schivo, I. R. ; Domingues, A. C. ; Sachs, D. ; Chiavegatto, S. ; Teixeira, M. M. ; Hothersall, J. S. ; Cruz, J. S. ; CUNHA, F. Q. ; FERREIRA, S. H. ; SACHS, D	A1	
artigoEmPeriodico	Daniela Sachs	2010		http://dx.doi.org/10.1016/j.jneuroim.2010.02.009	TNF-?, IL-1?, IL-6, and cinc-1 levels in rat brain after meningitis induced by Streptococcus pneumoniae	Journal of Neuroimmunology (Print)	Barichello, Tatiana ; dos Santos, Ivonete ; Savi, Geovana D. ; Simões, Lutiana R. ; Silvestre, Tiago ; Comim, Clarissa M. ; Sachs, Daniela ; Teixeira, Mauro M. ; Teixeira, Antonio L. ; Quevedo, João	Qualis nao identificado	JOURNAL OF NEUROIMMUNOLOGY
artigoEmPeriodico	Daniela Sachs	2010		http://dx.doi.org/10.1016/j.brainresbull.2010.04.015	Depressive-like-behavior and proinflamatory interleukine levels in the brain of rats submitted to pneumococcal meningitis	Brain Research Bulletin	Barichello, Tatiana ; dos Santos, Ivonete ; Savi, Geovana D. ; Simões, Lutiana R. ; Generoso, Jaqueline S. ; Comim, Clarissa M. ; Sachs, Daniela ; Teixeira, Antonio L. ; Quevedo, João	A3	
artigoEmPeriodico	Daniela Sachs	2010		http://dx.doi.org/10.4049/jimmunol.1000314	Anti-Inflammatory Effects of the Activation of the Angiotensin-(1-7) Receptor, Mas, in Experimental Models of Arthritis	The Journal of Immunology (1950)	da Silveira, K. D. ; COELHO, F. M. ; VIEIRA, A. T. ; SACHS, D. ; Barroso, L. C. ; COSTA, V. V. ; Bretas, T. L. B. ; Bader, M. ; de Sousa, L. P. ; da Silva, T. A. ; dos Santos, R. A. S. ; Simoes e Silva, A. C. ; Teixeira, M. M.	Qualis nao identificado	THE JOURNAL OF IMMUNOLOGY
artigoEmPeriodico	Daniela Sachs	2009		http://dx.doi.org/10.1016/j.bcp.2008.11.015	The peripheral pro-nociceptive state induced by repetitive inflammatory stimuli involves continuous activation of protein kinase A and protein kinase C epsilon and its NaV1.8 sodium channel functional regulation in the primary sensory neuron	Biochemical Pharmacology	Villarreal, Cristiane Flora ; Sachs, Daniela ; Funez, Mani Indiana ; Parada, Carlos Amílcar ; de Queiroz Cunha, Fernando ; Ferreira, Sérgio Henrique	Qualis nao identificado	BIOCHEMICAL PHARMACOLOGY
artigoEmPeriodico	Daniela Sachs	2009		http://dx.doi.org/10.1590/S0004-282X2009000100019	Mechanical hypernociception in experimental autoimmune encephalomyelitis	Arquivos de Neuro-Psiquiatria	Rodrigues, David Henrique ; SACHS, D ; Teixeira, Antonio Lucio	Qualis nao identificado	ARQUIVOS DE NEURO-PSIQUIATRIA
artigoEmPeriodico	Daniela Sachs	2009		http://dx.doi.org/10.1111/j.1476-5381.2008.00093.x	The role of PKA and PKCε pathways in prostaglandin E2-mediated hypernociception	British Journal of Pharmacology	SACHS, D; Villarreal, CF ; Cunha, FQ ; Parada, CA ; Ferreira, SH	Qualis nao identificado	BRITISH JOURNAL OF PHARMACOLOGY
artigoEmPeriodico	Daniela Sachs	2009		http://dx.doi.org/10.1073/pnas.0906467106	Essential role of platelet-activating factor receptor in the pathogenesis of Dengue virus infection. PNAS	Proceedings of the National Academy of Sciences of the United States of America,	Souza, D. G. ; Fagundes, C. T. ; Sousa, L. P. ; Amaral, F. A. ; Souza, R. S. ; Souza, A. L. ; Kroon, E. G. ; SACHS, D. ; CUNHA, F. Q. ; Bukin, E. ; Atrasheuskaya, A. ; Ignatyev, G. ; Teixeira, M. M.	A1	PROCEEDINGS OF THE NATIONAL ACADEMY OF SCIENCES OF THE UNITED STATES OF AMERICA
artigoEmPeriodico	Daniela Sachs	2009		http://dx.doi.org/10.1016/j.neulet.2009.10.039	Tumor necrosis factor alpha (TNF-?) levels in the brain and cerebrospinal fluid after meningitis induced by Streptococcus pneumoniae	Neuroscience Letters (Print)	Barichello, Tatiana ; dos Santos, Ivonete ; Savi, Geovana D. ; Florentino, Anelise F. ; Silvestre, Cintia ; Comim, Clarissa M. ; Feier, Gustavo ; Sachs, Daniela ; Teixeira, Mauro M. ; Teixeira, Antonio L.	Qualis nao identificado	NEUROSCIENCE LETTERS
artigoEmPeriodico	Daniela Sachs	2008		http://dx.doi.org/10.1016/j.mehy.2008.03.035	Up-regulation of chemokines and their receptors may contribute to pain in multiple sclerosis	Medical Hypotheses	SACHS, D; TEIXEIRA, A	Qualis nao identificado	MEDICAL HYPOTHESES
artigoEmPeriodico	Daniela Sachs	2008		http://dx.doi.org/10.1073/pnas.0807922105	Inaugural Article: Teleantagonism: A pharmacodynamic property of the primary nociceptive neuron. PNAS	Proceedings of the National Academy of Sciences of the United States of America	FUNEZ, M. I. ; Ferrari, L. F. ; Duarte, D. B. ; SACHS, D. ; CUNHA, F. Q. ; LORENZETTI, B. B. ; PARADA, C. A. ; FERREIRA, S. H.	A1	
artigoEmPeriodico	Daniela Sachs	2008		http://dx.doi.org/10.1073/pnas.0711891105	Commensal microbiota is fundamental for the development of inflammatory pain	PNAS. Proceedings of the National Academy of Sciences of the United States of America	Amaral, F. A. ; SACHS, D. ; COSTA, V. V. ; Fagundes, C. T. ; CISALPINO, D. ; CUNHA, T. M. ; FERREIRA, S. H. ; CUNHA, F. Q. ; Silva, T. A. ; NICOLI, J. R. ; VIEIRA, L. Q. ; Souza, D. G. ; Teixeira, M. M.	A1	
artigoEmPeriodico	Daniela Sachs	2008		http://dx.doi.org/10.1002/art.23622	The chemokine receptors CXCR1/CXCR2 modulate antigen-induced arthritis by regulating adhesion of neutrophils to the synovial microvasculature	Arthritis and Rheumatism	Coelho, Fernanda M. ; Pinho, Vanessa ; Amaral, FlÃ¡vio A. ; Sachs, Daniela ; Costa, VÃ­vian V. ; Rodrigues, David H. ; Vieira, AngÃ©lica T. ; Silva, TarcÃ­lia A. ; Souza, Daniele G. ; Bertini, Riccardo ; Teixeira, AntÃ´nio L. ; Teixeira, Mauro M.	Qualis nao identificado	ARTHRITIS AND RHEUMATISM
artigoEmPeriodico	Daniela Sachs	2006		http://dx.doi.org/10.1111/j.1460-9568.2006.04991.x	Peripheral antinociceptive effect of pertussisPeripheral antinociceptive effect of pertussis toxin: activation of the arginine⁄NO⁄cGMP⁄PKG⁄ATP-sensitive K+ channel pathway	European Journal of Neuroscience	BRITO, G. A. C. ; SACHS, D ; VALE, M. L. ; CUNHA, F. Q. ; LOTUFO, C. M. ; FERREIRA, S. H. ; RIBEIRO, R. A.	A4	
artigoEmPeriodico	Daniela Sachs	2005		http://dx.doi.org/10.1016/j.neulet.2005.04.060	The role of Na1.8 sodium channel in the maintenance of chronic inflammatory hypernociception	Neuroscience Letters, Ireland	VILLARREAL, C ; SACHS, D ; DEQUEIROZCUNHA, F ; PARADA, C ; FERREIRA, S	Qualis nao identificado	NEUROSCIENCE LETTERS, IRELAND
artigoEmPeriodico	Daniela Sachs	2004		http://dx.doi.org/10.1073/pnas.0308382101	Peripheral analgesic blockade of hypernociception: Activation of arginine/NO/cGMP/protein kinase G/ATP-sensitive K+ channel pathway. PNAS	Proceedings of the National Academy of Sciences of the United States of America, United States of America	SACHS, D.; CUNHA, F. Q. ; FERREIRA, S. H.	A1	PROCEEDINGS OF THE NATIONAL ACADEMY OF SCIENCES OF THE UNITED STATES OF AMERICA
artigoEmPeriodico	Daniela Sachs	2004		http://dx.doi.org/10.1038/sj.bjp.0705999	Antihyperalgesic effect of pentoxifylline on experimental inflammatory pain	British Journal of Pharmacology, Inglaterra	Vale, Mariana L ; Benevides, Verônica M ; Sachs, Daniela ; Brito, Gerly A C ; Rocha, Francisco A C ; Poole, Stephen ; Ferreira, Sérgio H ; Cunha, Fernando Q ; Ribeiro, Ronaldo A	Qualis nao identificado	BRITISH JOURNAL OF PHARMACOLOGY, INGLATERRA
artigoEmPeriodico	Daniela Sachs	2003		http://dx.doi.org/10.1038/sj.bjp.0705346	The critical role of leukotriene B 4 in antigen-induced mechanical hyperalgesia in immunised rats	British Journal of Pharmacology	Cunha, Joice Maria ; Sachs, Daniela ; Canetti, Claudio Azevedo ; Poole, Stephen ; Ferreira, Sérgio Henrique ; Cunha, Fernando Queiroz	Qualis nao identificado	BRITISH JOURNAL OF PHARMACOLOGY
artigoEmPeriodico	Daniela Sachs	2002		http://dx.doi.org/10.1016/S0304-3959(01)00433-X	Tumour necrosis factor-?, interleukin-1? and interleukin-8 induce persistent mechanical nociceptor hypersensitivity	Pain (Amsterdam), Estados Unidos	SACHS, D; CUNHA, F. Q. ; POOLE, S. ; FERREIRA, S. H.	Qualis nao identificado	PAIN , ESTADOS UNIDOS
trabalhoCompletoEmCongresso	Daniela Sachs	2012		Relatos de um mini curso de biotecnologia a partir das perspectivas da Alfabetização Científica	IV Encontro Nacional de Ensino de Biologia	GARCIA, G. M. P. ; REZENDE JUNIOR, M. F. ; SACHS, D		
trabalhoCompletoEmCongresso	Daniela Sachs	2012		Um mini curso de biotecnologia para alunos da 3ª série do ensino médio	Congresso de Práticas Educacionais: Gestão Escolar e Projetos Especiais	GARCIA, G. M. P. ; SACHS, D ; REZENDE JUNIOR, M. F.		
artigoEmPeriodico	Edmilson Otoni Corrêa	2025		http://dx.doi.org/10.1007/s00170-025-15131-8	Joining of Ti6Al4V/Al7075-T6 alloys without forming an intermediate layer by GMAW process	INTERNATIONAL JOURNAL OF ADVANCED MANUFACTURING TECHNOLOGY	SILVA, E. P. ; Castro, C.A.C ; CORREA, E. O. ; CORREA, E. O.	A2	
artigoEmPeriodico	Edmilson Otoni Corrêa	2024		http://dx.doi.org/10.1590/0104-9224/SI29.05	Avaliação da influência do aporte térmico na microestrutura da zona afetada pelo calor (ZAC) de juntas soldadas do aço inoxidável ENDUR 300	REVISTA SOLDAGEM E INSPEÇÃO	QUINTAO, B. M. ; CORREA, E. O. ; CORREA, E. O. ; OLIVEIRA, L. A. ; BARBOSA, R. P. ; FERREIRA, E. A. ; WINTHER, A. S.	Qualis nao identificado	REVISTA SOLDAGEM E INSPEÇÃO
artigoEmPeriodico	Edmilson Otoni Corrêa	2024		http://dx.doi.org/10.1590/1980-5373-mr-2023-0418	Stress-Corrosion Cracking Behavior of AISI-409 Welded with a filler metal flux cored AWS E316LT1-4	MATERIALS RESEARCH	SILVA, E. M. ; TEIXEIRA, R. L. P. ; COSTA, S. C. ; CORREA, E.O. ; Ribeiro, R.B.	A2	
artigoEmPeriodico	Edmilson Otoni Corrêa	2023		http://dx.doi.org/10.3390/ma16124480	Comparative Study of Corrosion Behaviors of WC-NiMo and WC-Co Cemented Carbides	Materials	BALBINO, NÁDIA ALVES NERY ; Corrêa, Edmilson Otoni ; HUANCA, DANILO ROQUE ; DE FREITAS MATOS, FLÁVIO AMAURY ; DE CARVALHO VALERIANO, LIVIO	A3	
artigoEmPeriodico	Edmilson Otoni Corrêa	2023		http://dx.doi.org/10.1007/s40194-023-01570-y	Optimization of FEM models for welding residual stress analysis using the modal method	Welding in the World	ARRUDA, M. V. ; CORREA, E.O. ; MACANHAN, V. B. P	Qualis nao identificado	WELDING IN THE WORLD
artigoEmPeriodico	Edmilson Otoni Corrêa	2022		http://dx.doi.org/10.1590/1980-5373-mr-2022-0108	Mechanical Properties of UNS S39274 Superduplex Stainless Steel Work Hardened and Solution Annealed	MATERIALS RESEARCH	CONCEICAO, J. N. ; CORREA, E. O. ; CORREA, E. O. ; Tavares, S.S.M ; PARDAL, J. M. ; GONZAGA, A. C.	A2	
artigoEmPeriodico	Edmilson Otoni Corrêa	2022		http://dx.doi.org/10.1590/1980-5373-mr-2022-0118	Effect of the Heat Input and Ageing Treatment on Microstructure and Mechanical Properties of AISI 317L Stainless Steel Dissimilar Welded Joints	MATERIALS RESEARCH	Antunes, P.D. ; SILVA, C. C. ; CORREA, E. O. ; CORREA, E. O.	A2	
artigoEmPeriodico	Edmilson Otoni Corrêa	2022		http://dx.doi.org/10.2139/ssrn.4217608	Comparative Study of Corrosion Behaviors of Wc-Nimo and Wc-Co Cemented Carbides	SSRN Electronic Journals: The English & Commonwealth Law Abstracts Journal	BALBINO, NÁDIA ALVES NERY ; Corrêa, Edmilson Otoni ; HUANCA, DANILO ROQUE ; MATOS, FLÁVIO AMAURY DE FREITAS	Qualis nao identificado	SSRN ELECTRONIC JOURNALS: THE ENGLISH & COMMONWEALTH LAW ABSTRACTS JOURNAL
artigoEmPeriodico	Edmilson Otoni Corrêa	2022			Optimization of Fem Models for Welding Residual Stress Analysis Using the Modal Method	Research Square	ARRUDA, M. V. ; CORREA, E. O. ; CORREA, E. O. ; MACANHAN, V. B. P	Qualis nao identificado	RESEARCH SQUARE
artigoEmPeriodico	Edmilson Otoni Corrêa	2021		http://dx.doi.org/10.1590/1980-5373-mr-2020-0456	Effect of Duplex Aging Heat Treatment on the Stress Corrosion Cracking Behavior of Ti-6Al-4V α+β Titanium Alloy in Methanol	MATERIALS RESEARCH	PAROLI SANTOS, P, C. ; CORREA, E. O. ; CORREA, E. O.	A2	
artigoEmPeriodico	Edmilson Otoni Corrêa	2020		http://dx.doi.org/10.1007/s13632-020-00685-8	Nitrides Precipitation and Preferential Pitting Corrosion of Ferrite Phase in UNS S39274 Superduplex Stainless Steel	METALLOGRAPHY, MICROSTRUCTURE, AND ANALYSIS (PRINT),	Tavares, S.S.M ; GONZAGA, A. C. ; PARDAL, J. M. ; CONCEICAO, J. N. ; CORREA, E. O. ; CORREA, E. O.	A4	METALLOGRAPHY, MICROSTRUCTURE, AND ANALYSIS
artigoEmPeriodico	Edmilson Otoni Corrêa	2019		http://dx.doi.org/10.1007/s40430-018-1515-8	Comparing the dynamic response of bead-on-plate and butt-welded plates	Journal of the Brazilian Society of Mechanical Sciences and Engineering	MACANHAN, VANESSA BAWDEN DE PAULA ; CORREA, EDMILSON OTONI ; DA SILVA, JOSÉ TADEU	A4	
artigoEmPeriodico	Edmilson Otoni Corrêa	2019		http://dx.doi.org/10.1590/1980-5373-2018-0774	Influence of the Solution-Treatment Temperature and Short Aging Times on The Electrochemical Corrosion Behaviour of Uns S32520 Super Duplex Stainless Steel	MATERIALS RESEARCH	VALERIANO, L.C. ; CORREA, E. O. ; CORREA, E. O. ; Mariano, N.A. ; Robin, A. ; Tommaselli, M. A. G.	A2	
artigoEmPeriodico	Edmilson Otoni Corrêa	2019		http://dx.doi.org/10.1007/s00170-019-03297-x	Vibration response analysis on stainless steel thin plate weldments	INTERNATIONAL JOURNAL OF ADVANCED MANUFACTURING TECHNOLOGY	DE PAULA MACANHAN, VANESSA BAWDEN ; CORREA, EDMILSON OTONI ; DE LIMA, ANTONIO MARCOS GONÇALVES ; DA SILVA, JOSE TADEU	A2	
artigoEmPeriodico	Edmilson Otoni Corrêa	2019		http://dx.doi.org/10.1007/s00170-019-04621-1	Influence of the heat input and aging treatment on microstructure and mechanical properties of AISI 317 L steel weldments using 0020 robotic-pulsed GMAW	INTERNATIONAL JOURNAL OF ADVANCED MANUFACTURING TECHNOLOGY	Antunes, P. D. ; SILVA, C. C. ; CORREA, E. O. ; CORREA, E. O. ; TAVARES, S. S. M.	A2	
artigoEmPeriodico	Edmilson Otoni Corrêa	2019			Influence of the Solution-Treatment Temperature and Short Aging Times on The Electrochemical Corrosion Behaviour of Uns S32520 Super Duplex Stainless Steel	MATERIALS RESEARCH	Valeriano, L. C. ; CORREA, E. O. ; MARIANO, Neide Aparecida ; ROBIM, A. L. M. ; Tommaselli, M. A. G. T.	A2	
artigoEmPeriodico	Edmilson Otoni Corrêa	2018		http://dx.doi.org/10.3390/met8030195	Stress Corrosion Cracking Behaviour of Dissimilar Welding of AISI 310S Austenitic Stainless Steel to 2304 Duplex Stainless Steel	Metals	VICENTE, T. A. ; OLIVEIRA, L. A. ; CORREA, E. O. ; CORREA, E. O. ; BARBOSA, R. P. ; MACANHAN, V. B. P ; ALCÂNTARA, N.G.	Qualis nao identificado	METALS
artigoEmPeriodico	Edmilson Otoni Corrêa	2018		http://dx.doi.org/10.1007/s00170-018-2511-y	Development of the 90WC-8Ni-2Cr3C2 cemented carbide for engineering applications	INTERNATIONAL JOURNAL OF ADVANCED MANUFACTURING TECHNOLOGY	BALBINO, NÁDIA ALVES NERY ; CORREA, EDMILSON OTONI ; DE CARVALHO VALERIANO, LÍVIO	A2	
artigoEmPeriodico	Edmilson Otoni Corrêa	2018		http://dx.doi.org/10.15406/mseij.2018.02.00071	Effect of weld metal chemistry on stress corrosion cracking susceptibility of austenitic Aisi 316/ 2304 duplex stainless steels dissimilar weldment DOI: 10.15406/mseij.2018.02.00071	Material Science & Engineering International Journal	OLIVEIRA, L. A. ; Edmilson O. Correa ; VALERIANO, L. C. ; BARBOSA, R. P. ; Barbedo, N.D. ; CHAVES, R. R.	Qualis nao identificado	MATERIAL SCIENCE & ENGINEERING INTERNATIONAL JOURNAL
artigoEmPeriodico	Edmilson Otoni Corrêa	2017		http://dx.doi.org/10.1016/j.ijrmhm.2017.06.009	Microstructure and mechanical properties of 90WC-8Ni-2Mo2C cemented carbide developed by conventional powder metallurgy	INTERNATIONAL JOURNAL OF REFRACTORY METALS & HARD MATERIALS	BALBINO, N. A. N. ; CORREA, E. O. ; CORREA, E. O. ; VALERIANO, L. C. ; Amâncio, D.A.	A2	INTERNATIONAL JOURNAL OF REFRACTORY METALS AND HARD MATERIALS
artigoEmPeriodico	Edmilson Otoni Corrêa	2016		http://dx.doi.org/10.1016/j.applthermaleng.2016.02.051	Microstructural analysis in GTA aluminum alloy welding using inverse problems	Applied Thermal Engineering	MAGALHÃES, E. S. ; SILVA, A. L. F. L. E. ; LIMA e SILVA, S. M. M ; CORREA, E. O. ; CORREA, E. O.	Qualis nao identificado	APPLIED THERMAL ENGINEERING
artigoEmPeriodico	Edmilson Otoni Corrêa	2015		http://dx.doi.org/10.1016/j.surfcoat.2015.06.026	The effect of microstructure on abrasive wear of a Fe-Cr-C-Nb hardfacing Alloy deposited by the Open Arc welding Process	Surface & Coatings Technology	CORREA, E.O.; ALCÂNTARA, N.G. ; VALERIANO, L.C. ; Barbedo, N.D. ; CHAVES, R.R.	A1	
artigoEmPeriodico	Edmilson Otoni Corrêa	2015			Analise microestrutural do processo de soldagem MAG com pulsação térmica e sua relação com os níveis de energia	Revista de Engenharia e Tecnologia	FONSECA, R. ; HINCAPIE, C. A. A. ; CORREA, E. O. ; CORREA, E. O. ; COSTA, S. C.	B4	
artigoEmPeriodico	Edmilson Otoni Corrêa	2014		http://dx.doi.org/10.4028/www.scientific.net/msf.805.305	Effect of Solubilization Temperature on the Sigma Phase Precipitation of a Superduplex Stainless Steel	Materials Science Forum (Online)	DA SILVA, ALINE ; RODRIGUES, CARLOS ALBERTO ; ANCELOTTI, ANTONIO CARLOS ; OTONI CORRÊA, EDMILSON ; NORONHA MELO, M.L.M.	B3	
artigoEmPeriodico	Edmilson Otoni Corrêa	2014			Statistical model to evaluate the weldability, mechanical and metallurgical Properties of the Processes GMAW and FCAW	Lecture Notes in Engineering and Computer Science	Barbedo, N.D. ; CORREA, E.O. ; Castro, C.A.C	Qualis nao identificado	LECTURE NOTES IN ENGINEERING AND COMPUTER SCIENCE
artigoEmPeriodico	Edmilson Otoni Corrêa	2013		http://dx.doi.org/10.1590/S1516-14392012005000185	Finite element reduction strategy for Composite Sandwich Plates with Viscoelastic Layers. Materials Research (São Carlos	Impresso)	Diacenco, A.A. ; Lima, A.M.G. ; CORREA, E. O. ; CORREA, E. O.	Qualis nao identificado	IMPRESSO)
artigoEmPeriodico	Edmilson Otoni Corrêa	2013		http://dx.doi.org/10.1590/S1517-70762013000300005	Influência do tratamento térmico de envelhecimento a 850ºC na microestrutura e nas propriedades mecânicas e magnéticas do aço Duplex UNS S31803	Matéria (UFRJ)	CORREA, E. O.; MENDONCA, C. S. P. ; SILVA, M. R. ; RODRIGUES, C. A. ; Melo, M.L.N.M ; CORREA, E. O.	B1	
artigoEmPeriodico	Edmilson Otoni Corrêa	2013		http://dx.doi.org/10.1002/maco.201106186	Effect of weld metal chemistry on stress corrosion cracking behavior of AISI 444 ferritic stainless steel weldments in boiling chloride solution	Materials and Corrosion (1995)	ANTUNES, P. D. ; CORREA, E. O. ; BARBOSA, R. P. ; SILVA, E. M. ; PADILHA, A. F. ; GUIMARAES, P. M.	A3	
artigoEmPeriodico	Edmilson Otoni Corrêa	2012		http://dx.doi.org/10.4149/km_2012_2_69	Influence of corrosive solution temperature on the SCC behavior of the AISI 310 and AISI 316 stainless steels rolled plates	Kovové Materiály	Fernandes, J.C. ; E.O. Correa ; Melo, M.L.N.M ; BARBOSA, R. P.	Qualis nao identificado	KOVOVÉ MATERIÁLY
artigoEmPeriodico	Edmilson Otoni Corrêa	2012		http://dx.doi.org/10.1520/JAI103436	Mechanical and Microstrutural Characterization of Weldments of Ferritic Stainless Steel AISI 444 Using Austenitic Stainless Steels Filler Metals	Journal of ASTM International (Online)	Antunes, P.D. ; Corrêa, Edmilson Otoni ; Barbedo, N.D. ; Souza, P.O. ; GONCALVES, J.L. ; Diacenco, A.A.	Qualis nao identificado	JOURNAL OF ASTM INTERNATIONAL
artigoEmPeriodico	Edmilson Otoni Corrêa	2011		http://dx.doi.org/10.3139/146.110593	Microestructure and Mechanical Properties of WC-Ni-Al cemented carbides for Engineering Aplications	International Journal of Materials Research	Edmilson O. Correa; SANTOS, J. N. ; Klein, A.N.	B1	
artigoEmPeriodico	Edmilson Otoni Corrêa	2010		http://dx.doi.org/10.4322/tmm.00603008	Desenvolvimento de metais duros WC-Ni-Si para aplicações de engenharia. Tecnologia em Metalurgia e Materiais (São Paulo	Impresso)	SANTOS, J. N. ; Klein, A.N. ; CORREA, E. O. ; CORREA, E. O.	Qualis nao identificado	IMPRESSO)
artigoEmPeriodico	Edmilson Otoni Corrêa	2010		http://dx.doi.org/10.4236/eng.2010.25051	Influence of Clad Metal Chemistry on Stress Corrosion Cracking Behaviour of Stainless Steels Claddings in Chloride Solution	Engineering	Edmilson O. Correa; BARBOSA, R. P. ; BUSCHINELLI, A. J. A. ; SILVA, E. M.	Qualis nao identificado	ENGINEERING
artigoEmPeriodico	Edmilson Otoni Corrêa	2010		http://dx.doi.org/10.1016/j.ijrmhm.2010.04.003	Microstructure and mechanical properties of WC Ni-Si based cemented carbides developed by powder metallurgy. International Journal of Refractory & Hard Metals (Cessou em 1988. Cont	0958-0611 International Journal of Refractory Metals & Hard Materials)	CORREA, E. O.; CORREA, E. O. ; SANTOS, J. N. ; Klein, A.N.	Qualis nao identificado	0958-0611 INTERNATIONAL JOURNAL OF REFRACTORY METALS & HARD MATERIALS)
artigoEmPeriodico	Edmilson Otoni Corrêa	2010			Influência da composição química do metal de adição nas propriedades mecânicas e na susceptibilidade à corrosão sob tensão de juntas soldadas do aço inoxidável ferrítico AISI 444	Ciência e tecnologia dos materiais	Antunes, P.D. ; CORREA, E. O. ; CORREA, E. O. ; CORTEZ, R. M. ; Nascimento, A.	B1	
artigoEmPeriodico	Edmilson Otoni Corrêa	2010			Estudo da influencia da composição química do metal de adição nas propriedades mecânicas e na susceptibilidade à corrosão sob tensão de juntas soldadas do aço inoxidável ferrítico AISI 444, focadas para aplicações na industria petrolífera	Petro & Química	Antunes, P.D. ; Corrêa, Edmilson Otoni ; CORTEZ, R. M. ; Nascimento, A.	Qualis nao identificado	PETRO & QUÍMICA
artigoEmPeriodico	Edmilson Otoni Corrêa	2009		http://dx.doi.org/10.1016/j.jmatprotec.2008.09.008	Studies on weldability of iron based powder metal alloys using pulsed gas tungsten arc welding process	Journal of Materials Processing Technology	CORREA, E. O.; CORREA, E. O. ; COSTA, S. C. ; SANTOS, J. N.	Qualis nao identificado	JOURNAL OF MATERIALS PROCESSING TECHNOLOGY
artigoEmPeriodico	Edmilson Otoni Corrêa	2008		http://dx.doi.org/10.1016/j.jmatprotec.2007.07.007	Weldabilitity of Iron Based Powder Metal Alloys using the Pulsed Plasma Arc Process	Journal of Materials Processing Technology	CORREA, E. O.; COSTA, S. C. ; SANTOS, J. N.	Qualis nao identificado	JOURNAL OF MATERIALS PROCESSING TECHNOLOGY
artigoEmPeriodico	Edmilson Otoni Corrêa	2008		http://dx.doi.org/10.4322/tmm.00403003	Desenvolvimento de ligas ferrosas para solda de revestimento duro auxiliado por simulações termodinâmicas. Tecnologia em Metalurgia e Materiais (São Paulo	Impresso)	CORREA, E. O.; CORREA, E. O. ; ALCÂNTARA, N. G. ; TECCO, D. G. ; KUMAR, R. V.	Qualis nao identificado	IMPRESSO)
artigoEmPeriodico	Edmilson Otoni Corrêa	2008			Carbonetos complexos melhoram resistência de Liga para Solda de Revestimento	Corte e Conformação de Metais	E.O. Correa; ALCÂNTARA, N. G. ; TECCO, D. G. ; KUMAR, R. V.	Qualis nao identificado	CORTE E CONFORMAÇÃO DE METAIS
artigoEmPeriodico	Edmilson Otoni Corrêa	2007		http://dx.doi.org/10.1590/S1516-14392007000300019	Thermodynamics simulations as an Assistant Tool in the Development of Iron Based Hardfacing Materials	Materials Research	CORREA, E. O.; ALCÂNTARA, N. G. ; TECCO, D. G. ; KUMAR, R. V.	A2	
