artigoEmPeriodico	Alfeu Saraiva Ramos	2024		http://dx.doi.org/10.1590/0370-44672023770004	Influence of heat treatment on the microstructure of a sintered bronze-aluminum alloy	REM - INTERNATIONAL ENGINEERING JOURNAL	Eduardo Serafim Silva ; Elioenai Levi Barbedo ; Alexandre Nogueira Ottoboni Dias ; Daniela Sachs ; Gilbert Silva ; Alfeu Saraiva Ramos	A4	
artigoEmPeriodico	Alfeu Saraiva Ramos	2022		http://dx.doi.org/10.1590/0366-69132022683863210	Microstructure and diametral fracture strength of spark plasma sintered WC-6Co-0.2B and WC-6Co-0.5B ceramic composites from nanosized and metastable WC powders	CERÂMICA	SILVA, G. S. DE ALENCAR E ; LEAL NETO, R. M. ; FILGUEIRA, M. ; BAPTISTA, C. A. R. P. ; SANTOS, C. DOS ; RAMOS, A. S.	B1	
artigoEmPeriodico	Alfeu Saraiva Ramos	2022		http://dx.doi.org/10.1007/s11669-022-00973-6	The 1300 °C Isothermal Section in the Al2O3-Y2O3-Nb2O5 System	JOURNAL OF PHASE EQUILIBRIA AND DIFFUSION	ZAIDAN, DENILSON WAGNER ; DE FREITAS, BRUNO XAVIER ; COELHO, Gilberto Carvalho ; NUNES, Carlos Angelo ; DOS SANTOS, CLAUDINEI ; RAMOS, Erika Coaglia Trindade ; RAMOS, ALFEU SARAIVA	A3	
artigoEmPeriodico	Alfeu Saraiva Ramos	2020		http://dx.doi.org/10.1166/jnn.2020.17869	Preparation of TiC/Ti SiC Composite by Sintering Mechanical Alloyed Ti-Si-C Powder Mixtures	JOURNAL OF NANOSCIENCE AND NANOTECHNOLOGY	PAIS ALVES, MANUEL FELLIPE R. ; SANTOS, CLAUDINEI DOS ; FREITAS, BRUNO XAVIER DE ; RAMOS, ALFEU SARAIVA ; RAMOS, Erika Coaglia Trindade ; STRECKER, KURT	B2	
artigoEmPeriodico	Alfeu Saraiva Ramos	2020		http://dx.doi.org/10.1590/1980-5373-MR-2019-0144	Characterization of alloys of the Sn-Zn system produced by melt spinning	Materials Research-Ibero-american Journal of Materials	CORDIOLLI, L. ; SOUSA, L. L. ; RAMOS, A S ; GARGARELLA, P. ; Mariano, N. A.	Qualis nao identificado	MATERIALS RESEARCH-IBERO-AMERICAN JOURNAL OF MATERIALS
artigoEmPeriodico	Alfeu Saraiva Ramos	2020		http://dx.doi.org/10.1016/j.mtcomm.2019.100767	Spark plasma sintering of Ti6Si2B-based Ti-Si-B alloys and their corrosion resistance in artificial saliva and SBF media	Materials Today Communications	FIORIN, B. O. ; HOLLAND, T. ; Ferreira, L. M. ; SOUSA, L. L. ; Mariano, N. A. ; NUNES, Carlos Angelo ; RAMOS, ALFEU SARAIVA	A4	
artigoEmPeriodico	Alfeu Saraiva Ramos	2020		http://dx.doi.org/10.1007/s40430-020-02431-1	Mechanical properties of biocompatible Y-TZP/Al2O3 composites obtained from mechanically alloyed powders	Journal of the Brazilian Society of Mechanical Sciences and Engineering	DE FREITAS, BRUNO XAVIER ; ALVES, MANUEL FELLIPE R. PAIS ; SANTOS, CLAUDINEI ; RAMOS, ALFEU SARAIVA ; RAMOS, Erika Coaglia Trindade ; STRECKER, KURT	A4	
artigoEmPeriodico	Alfeu Saraiva Ramos	2020		http://dx.doi.org/10.1016/j.jmrt.2020.07.059	Influence of the microstructure on the life prediction of hydrothermal degraded 3Y-TZP bioceramics	Journal of Materials Research and Technology-JMR&T	ABREU, L. G. ; QUINTINO, M. N. ; ALVES, M. F. R. P. ; HABIBE, C. H. ; RAMOS, A. S. ; SANTOS, C.	A1	JOURNAL OF MATERIALS RESEARCH AND TECHNOLOGY
artigoEmPeriodico	Alfeu Saraiva Ramos	2020		http://dx.doi.org/10.1590/1980-5373-mr-2020-0337	Effect of Cobalt Doping and Milling Time on Microstructure and Vickers Microhardness of the Spark Plasma Sintered (67-x)Ti-xCo-22Si-11B (x = 2 and 6 at-%) Alloys	MATERIALS RESEARCH	FERREIRA, NELSON DAMÁSIO ; LEAL NETO, RICARDO MENDES ; FILGUEIRA, Marcello ; ALVES, MANUEL FELLIPE RODRIGUES PAIS ; SANTOS, CLAUDINEI DOS ; RAMOS, ALFEU SARAIVA	A2	
artigoEmPeriodico	Alfeu Saraiva Ramos	2019		http://dx.doi.org/10.3390/met9050589	Influence of Niobium or Molybdenum Addition on Microstructure and Tensile Properties of Nickel-Chromium Alloys	Metals	SOUZA, MARISA APARECIDA DE ; FIORIN, BÁRBARA DE OLIVEIRA ; HASHIMOTO, Tomaz Manabu ; ROSIFINI, ANA PAULA ; NUNES, Carlos Angelo ; BAPTISTA, CARLOS ANTÔNIO REIS PEREIRA ; RAMOS, ALFEU SARAIVA	Qualis nao identificado	METALS
artigoEmPeriodico	Alfeu Saraiva Ramos	2019		http://dx.doi.org/10.1016/j.jallcom.2019.05.196	Microstructure and corrosion behavior in SBF medium of spark plasma sintered Ti-xZr-20Si-10B (x = 5, 7, 10, 15, 20-at.-%) alloys	JOURNAL OF ALLOYS AND COMPOUNDS	BERTOLI, ISADORA ROSSI ; FILGUEIRA, Marcello ; FERREIRA, LUCAS MOREIRA ; DE SOUSA, LUCÍOLA LUCENA ; MARIANO, NEIDE APARECIDA ; RAMOS, ALFEU SARAIVA ; NUNES, Carlos Angelo ; SANTOS, CLAUDINEI DOS ; RAMOS, Erika Coaglia Trindade	A1	
artigoEmPeriodico	Alfeu Saraiva Ramos	2019		http://dx.doi.org/10.1016/j.jallcom.2019.04.172	Microstructure and Vickers hardness of mechanically alloyed and spark plasma sintered Ti-2Zn-22Si-11B and Ti-6Zn-22Si-11B alloys	JOURNAL OF ALLOYS AND COMPOUNDS	FERREIRA, NELSON DAMÁSIO ; LEAL NETO, RICARDO MENDES ; FILGUEIRA, Marcello ; FERREIRA, LUCAS MOREIRA ; RODRIGUES PAIS ALVES, MANUEL FELLIPE ; TRINDADE RAMOS, ERIKA COAGLIA ; NUNES, Carlos Angelo ; SANTOS, CLAUDINEI DOS ; RAMOS, ALFEU SARAIVA	A1	
artigoEmPeriodico	Alfeu Saraiva Ramos	2019		http://dx.doi.org/10.1016/j.ceramint.2019.09.225	Development of dense Al2O3-TiO2 ceramic composites by the glass-infiltration of porous substrates prepared from mechanical alloyed powders	CERAMICS INTERNATIONAL	ALVES, MANUEL F.R.P. ; SANTOS, CLAUDINEI DOS ; COSSU, CAIO M.F.A. ; SUZUKI, PAULO A. ; RAMOS, ALFEU S. ; RAMOS, ERIKA C.T. ; SIMBA, BRUNO G. ; STRECKER, KURT	A1	
artigoEmPeriodico	Alfeu Saraiva Ramos	2019		http://dx.doi.org/10.1590/1980-5373-mr-2019-0177	Titanium Biomimetically Coated With Hydroxyapatite, Silver Nitrate and Polycaprolactone, for Use In Biomaterials (Biomedicine)	MATERIALS RESEARCH	FERREIRA, CAROLINA CRUZ ; SOUSA, LUCÍOLA LUCENA DE ; RICCI, VIRGILIO PEREIRA ; RIGO, ELIANA CRISTINA DA SILVA ; RAMOS, ALFEU SARAIVA ; CAMPOS, MARIA GABRIELA NOGUEIRA ; MARIANO, NEIDE APARECIDA	A2	
artigoEmPeriodico	Alfeu Saraiva Ramos	2018		http://dx.doi.org/10.17563/rbav.v36i3.1070	Effects of plasma immersion ion implantation on fatigue properties of titanium alloy surfaces	Revista Brasileira de Aplicações do Vácuo on Line	SOUZA, MARIA LUIZA RINALDI ; FERNANDES, Bruno Bacci ; MÄNDL, STEPHAN ; OLIVEIRA, ROGÉRIO MORAES ; UEDA, MARIO ; RAMOS, ALFEU SARAIVA	Qualis nao identificado	REVISTA BRASILEIRA DE APLICAÇÕES DO VÁCUO ON LINE
artigoEmPeriodico	Alfeu Saraiva Ramos	2018		http://dx.doi.org/10.3390/met8020082	Mechanical Alloying and Hot Pressing of Ti-Zr-Si-B Powder Mixtures	Metals	ROSSI BERTOLI, ISADORA ; MOREIRA FERREIRA, LUCAS ; XAVIER DE FREITAS, BRUNO ; ANGELO NUNES, CARLOS ; SARAIVA RAMOS, ALFEU ; FILGUEIRA, Marcello ; DOS SANTOS, CLAUDINEI ; COAGLIA TRINDADE RAMOS, ERIKA	Qualis nao identificado	METALS
artigoEmPeriodico	Alfeu Saraiva Ramos	2017			Structural evaluation of Ti-Cr-Si-B powders produced by high-energy ball milling and sintering	MATERIALS SCIENCE FORUM	Maruya, L. O. V. ; SUZUKI, Paulo A ; RAMOS, A. S.	B3	
artigoEmPeriodico	Alfeu Saraiva Ramos	2017			High-energy Ball Milling and Subsequent Heat Treatment of Ti-Cu-Si-B Powders	MATERIALS SCIENCE FORUM	Ferreira, L. M. ; FERNANDES, Bruno Bacci ; Ueda, M. ; Alfeu Saraiva Ramos	B3	
artigoEmPeriodico	Alfeu Saraiva Ramos	2017			Phase Transformations in Mechanically Alloyed and Sintered Ti-XMg-22Si-11B (X = 2 and 7 at.-%at) Powders	MATERIALS SCIENCE FORUM	Maruya, L. O. V. ; FERNANDES, Bruno Bacci ; Ueda, M. ; Alfeu Saraiva Ramos	B3	
artigoEmPeriodico	Alfeu Saraiva Ramos	2017			Structural Evaluation of Mechanically Alloyed W-50at%C Powder	MATERIALS SCIENCE FORUM	SILVA, G. S. A. ; Neto, R. M. L. ; Vinícius André Rodrigues Henriques ; CAIRO, C. A. A. ; Alfeu Saraiva Ramos	B3	
artigoEmPeriodico	Alfeu Saraiva Ramos	2017		http://dx.doi.org/10.1080/00084433.2017.1299907	Excess aluminium effect on the composition and microstructure of Mo-Al alloys from aluminothermic reduction of MoO 3	CANADIAN METALLURGICAL QUARTERLY,	SANDIM, H. R. Z. ; Alfeu Saraiva Ramos ; SUZUKI, Paulo A ; Alkmin, L. B. ; CHAIA, N. ; NUNES, Carlos Angelo	Qualis nao identificado	CANADIAN METALLURGICAL QUARTERLY,
artigoEmPeriodico	Alfeu Saraiva Ramos	2017			Microstructure and Oxidation Resistance of Mechanically Alloyed and Sintered Ni-Nb and Ni-Nb-Ta Alloys	MATERIALS SCIENCE FORUM	Ferreira, L. M. ; REZENDE, S. C. ; SILVA, A. A. A. P. ; POIRIER, G. Y. ; COELHO, Gilberto Carvalho ; Alfeu Saraiva Ramos	B3	
artigoEmPeriodico	Alfeu Saraiva Ramos	2017			Mechanical Alloying and Sintering of Ni-Sn and Ni-Mg Powder Mixtures	MATERIALS SCIENCE FORUM	FARIA, G. H. C. ; MAGALHAES, R. B. ; ZANARDO, A. C. ; RAMOS, Erika Coaglia Trindade ; SILVA, A. A. A. P. ; COELHO, Gilberto Carvalho ; Alfeu Saraiva Ramos	B3	
artigoEmPeriodico	Alfeu Saraiva Ramos	2016		http://dx.doi.org/10.1016/j.ceramint.2015.10.151	Characterization and photocatalytic evaluation of ZnO-Co3O4 particles obtained by high energy milling. Part II: Photocatalytic properties	Ceramics International	DIAS, JEFERSON ALMEIDA ; ARANTES, VERA LUCIA ; RAMOS, ALFEU SARAIVA ; GIRALDI, TANIA REGINA ; MINUCCI, MARÍLIA ZANI ; MAESTRELLI, SYLMA CARVALHO	A1	
artigoEmPeriodico	Alfeu Saraiva Ramos	2016		http://dx.doi.org/10.4028/www.scientific.net/MSF.869.19	Structural and Microstructural Properties of Si-C and Si-C-B Powders Obtained by High-Energy Ball Milling	Materials Science Forum (Online)	Ferreira, L. M. ; MEGDA, D. S. ; SOUZA, A. C. ; Marques, R. F. C ; RAMOS, Erika Coaglia Trindade ; CHAD, V. M. ; RAMOS, ALFEU SARAIVA	B3	
artigoEmPeriodico	Alfeu Saraiva Ramos	2016		http://dx.doi.org/10.4028/www.scientific.net/MSF.869.58	Effect of Boron and Carbon Addition on the Phase Transformations during High-Energy Ball Milling and Subsequent Sintering of Si3N4+B and Si3N4+C Powder Mixtures	Materials Science Forum (Online)	Maruya, L. O. V. ; LARA, B. R. B. ; DOS SANTOS, B. B. ; COELHO, Gilberto Carvalho ; CHAD, V. M. ; Alfeu Saraiva Ramos	B3	
artigoEmPeriodico	Alfeu Saraiva Ramos	2016		http://dx.doi.org/10.4028/www.scientific.net/MSF.869.350	Processing of Pet-Silver Nanocomposite Filaments	Materials Science Forum (Online)	GUERRA, M. A. ; Mariano, N. A. ; Alfeu Saraiva Ramos ; Campos, M. G. N.	B3	
artigoEmPeriodico	Alfeu Saraiva Ramos	2016		http://dx.doi.org/10.4028/www.scientific.net/MSF.869.423	Formation of Ni3Ta, Ni2Ta and NiTa by High-Energy Ball Milling and Subsequent Heat Treatment	Materials Science Forum (Online)	BENITES, H. S. N. ; SILVA, B. P. ; SILVA, A. A. A. P. ; DOS SANTOS, B. B. ; COELHO, Gilberto Carvalho ; Alfeu Saraiva Ramos	B3	
artigoEmPeriodico	Alfeu Saraiva Ramos	2016		http://dx.doi.org/10.4028/www.scientific.net/MSF.869.789	Synthesis and Photocatalytic Evaluation of Nanocrystalline ZnO Obtained by High Energy Milling	Materials Science Forum (Online)	DIAS, JEFERSON A. ; ARANTES, Vera Lúcia ; RAMOS, ALFEU SARAIVA ; GIRALDI, TANIA R. ; MINUCCI, MARÍLIA Z. ; TOLEDO, MAURO F. ; MAESTRELLI, SYLMA CARVALHO	B3	
artigoEmPeriodico	Alfeu Saraiva Ramos	2015		http://dx.doi.org/10.1016/j.ceramint.2014.10.029	Synthesis of TaAlO4 compound and Al2O3-TaAlO4 composite ceramic by mechanical alloying and their sintering	Ceramics International	GONDIM, M. F. ; Maestrelli, S. C. ; RAMOS, Erika Coaglia Trindade ; José Augusto Jorge Rodrigues ; RAMOS, ALFEU S.	A1	
artigoEmPeriodico	Alfeu Saraiva Ramos	2015		http://dx.doi.org/10.4028/www.scientific.net/MSF.820.483	Effect of Superplasticizer Additives for Class Type Cpii E32 Cements	Materials Science Forum (Online)	GRILLO, R.H.F. ; Maestrelli, S. C. ; FERRACO, F. ; RAMOS, A. S. ; Mariano, N. A.	B3	
artigoEmPeriodico	Alfeu Saraiva Ramos	2015		http://dx.doi.org/10.1016/j.ceramint.2015.09.086	Characterization and photocatalytic evaluation of ZnO-Co3O4 particles obtained by high energy milling. Part I: Processing, physicochemical and thermal characterization	Ceramics International	DIAS, JEFERSON ALMEIDA ; ARANTES, VERA LUCIA ; RAMOS, ALFEU SARAIVA ; GIRALDI, TANIA REGINA ; MINUCCI, MARÍLIA ZANI ; MAESTRELLI, SYLMA CARVALHO	A1	
artigoEmPeriodico	Alfeu Saraiva Ramos	2014		http://dx.doi.org/10.1016/j.jallcom.2014.02.179	Effect of zirconium addition on the phase transformations in as-cast and heat-treated Ti-Zr-Si-B alloys	Journal of Alloys and Compounds,	RAMOS, ALFEU SARAIVA; NUNES, Carlos Angelo ; RODRIGUES, Geovani ; RAMOS, Erika Coaglia Trindade	A1	JOURNAL OF ALLOYS AND COMPOUNDS
artigoEmPeriodico	Alfeu Saraiva Ramos	2014		http://dx.doi.org/10.4028/www.scientific.net/msf.802.9	Phase Transformation in Mechanically Alloyed and Hot-Pressed Ti-2Nb-22Si-11B and Ti-6Nb-22Si-11B Powder Mixtures	Materials Science Forum (Online)	Zanardo, A. C. ; Mariano, N. A. ; Alkmin, L. B. ; COSTA, A. M. S. ; NUNES, Carlos Angelo ; RAMOS, A. S.	B3	
artigoEmPeriodico	Alfeu Saraiva Ramos	2014		http://dx.doi.org/10.4028/www.scientific.net/msf.802.20	High-Energy Ball Milling and Sintering of Ti-2Ta-22Si-11B and Ti-6Ta-22Si-11B Powders Mixtures	Materials Science Forum (Online)	Ferreira, L. M. ; Alkmin, L. B. ; RAMOS, Erika Coaglia Trindade ; NUNES, Carlos Angelo ; RAMOS, A. S.	B3	
artigoEmPeriodico	Alfeu Saraiva Ramos	2014		http://dx.doi.org/10.4028/www.scientific.net/msf.802.14	Phase Transformation in Mechanically Alloyed and Hot-Pressed Nb-4Si-8B and Nb-8Si-16B Alloys	Materials Science Forum (Online)	Chiaradia, C. E. ; Alkmin, L. B. ; NUNES, Carlos Angelo ; Vinícius André Rodrigues Henriques ; Pereira, G. M. C. ; RAMOS, A. S.	B3	
artigoEmPeriodico	Alfeu Saraiva Ramos	2014		http://dx.doi.org/10.4028/www.scientific.net/MSF.802.29	High-Energy Ball Milling and Hot Pressing of the Ni-48Ti-2Sn and Ni-45Ti-5Sn Powder Mixtures	Materials Science Forum (Online)	Kayano, L. K. ; Murusawa, D. ; Pereira, G. M. C. ; RAMOS, A. S.	B3	
artigoEmPeriodico	Alfeu Saraiva Ramos	2014		http://dx.doi.org/10.4028/www.scientific.net/msf.802.3	Structural Evolution of Ti-Fe-Si-B Alloys Produced by High-Energy Ball Milling and Sintering	Materials Science Forum (Online)	Pereira, W. L. ; BERTOLLI, I. R. ; FRANZE, J. A. ; RAMOS, A. S. ; Mariano, N. A. ; NUNES, Carlos Angelo ; RAMOS, Erika Coaglia Trindade	B3	
artigoEmPeriodico	Alfeu Saraiva Ramos	2014		http://dx.doi.org/10.1590/s1516-14392014005000076	Study of Ti-7.5Si-22.5B alloys produced by powder metallurgy. Materials Research (São Carlos	Impresso)	FERNANDES, Bruno Bacci ; MOURA NETO, C. ; Alfeu Saraiva Ramos ; MELO, F. C. L. ; Vinícius André Rodrigues Henriques	Qualis nao identificado	IMPRESSO)
artigoEmPeriodico	Alfeu Saraiva Ramos	2014			Sintering of Al2O3-TiO2 Mixtures Obtained by High-Energy Ball Milling	Advances in Science and Technology (Online)	Alfeu Saraiva Ramos; Souza, M. A. ; MAGNAGO, R. O. ; SANTOS, C. ; SILVA, C. A. A. ; FORTES, B. A.	Qualis nao identificado	ADVANCES IN SCIENCE AND TECHNOLOGY
artigoEmPeriodico	Alfeu Saraiva Ramos	2013		http://dx.doi.org/10.1016/j.surfcoat.2013.04.029	Effects of high temperature plasma immersion ion implantation on wear resistance of Ti-Si-B sintered alloys	Surface & Coatings Technology	Titanium alloys ; FERNANDES, Bruno Bacci ; Oliveira, R. M. ; Ueda, M. ; MARIANO, S. F. M. ; RAMOS, A. S. ; VIEIRA, M. S. ; MELO, F. C. L. ; OLIVEIRA, G.	A1	
artigoEmPeriodico	Alfeu Saraiva Ramos	2013		http://dx.doi.org/10.1590/s1516-14392013005000172	Isothermal section of the Ti-Si-B system at 1250 ° C in the Ti-TiSi2-TiB2 region. Materials Research (São Carlos	Impresso)	RAMOS, ALFEU SARAIVA; BALDAN, RENATO ; NUNES, Carlos Angelo ; COELHO, Gilberto Carvalho ; SUZUKI, PAULO ATSUSHI ; RODRIGUES, Geovani	Qualis nao identificado	IMPRESSO)
artigoEmPeriodico	Alfeu Saraiva Ramos	2012		http://dx.doi.org/10.4028/www.scientific.net/msf.727-728.287	Physicochemical Analysis of Ti-Si-B Powder Alloys	Materials Science Forum (Online)	FERNANDES, Bruno Bacci ; Salem, G. A. ; Ueda, M. ; RAMOS, A. S.	B3	
artigoEmPeriodico	Alfeu Saraiva Ramos	2012		http://dx.doi.org/10.4028/www.scientific.net/msf.727-728.1193	Preparation of Al2TiO5-Al2O3 and Al2TiO5-Al2O3-TiO2	Materials Science Forum (Online)	Caltabiano, P. C. R. O. ; Souza, M. A. ; Marques, R. F. C. ; Campos, M. G. N. ; Hein, L. R. O ; RAMOS, A. S.	B3	
artigoEmPeriodico	Alfeu Saraiva Ramos	2012		http://dx.doi.org/10.4028/www.scientific.net/msf.727-728.222	On the Phase Transformation in Mechanically Alloyed Ni-Nb and Ni-Ta and Ni-Nb-Ta Powders	Materials Science Forum (Online)	Ferraretto, A. C. ; RAMOS, Erika Coaglia Trindade ; RAMOS, A. S.	B3	
artigoEmPeriodico	Alfeu Saraiva Ramos	2012		http://dx.doi.org/10.4028/www.scientific.net/msf.727-728.462	High-Pressure Assisted Sintering of Ti-20Si-10B and Ti-10Si-5B Powders	Materials Science Forum (Online)	Pereira, W. L. ; RAMOS, Erika Coaglia Trindade ; RAMOS, A. S. ; SILVA, Alexandro Nakano ; LIMA, Filipe Tavares Caetano ; FILGUEIRA, Marcello	B3	
artigoEmPeriodico	Alfeu Saraiva Ramos	2012		http://dx.doi.org/10.4028/www.scientific.net/msf.727-728.233	Preparation of Ni-Ti-Mo and Ni-Ti-Mo-Zr Alloys by High-Energy Ball Milling and Subsequent Hot Pressing	Materials Science Forum (Online)	Pereira, G. M. C. ; Souza, M. A. ; HASHIMOTO, Tomaz Manabu ; HENRIQUES, Vinícius A R ; RAMOS, A. S.	B3	
artigoEmPeriodico	Alfeu Saraiva Ramos	2012		http://dx.doi.org/10.4028/www.scientific.net/msf.727-728.216	Effect of Molybdenum on the Formation of Ti6Si2B in Mechanically Alloyed Ti-Mo-Si-B Powders	Materials Science Forum (Online)	Nunes, P. A. ; RAMOS, A. S. ; RAMOS, Erika Coaglia Trindade	B3	
artigoEmPeriodico	Alfeu Saraiva Ramos	2012		http://dx.doi.org/10.4028/www.scientific.net/msf.727-728.210	Structural Evaluation of Mechanically Alloyed (67-x)Ti-xZr-22Si-11B Powders	Materials Science Forum (Online)	RAMOS, A. S.; Marzullo, A. C. M. ; RAMOS, Erika Coaglia Trindade ; Dalcy Roberto dos Santos ; HENRIQUES, Vinícius A R	B3	
artigoEmPeriodico	Alfeu Saraiva Ramos	2012		http://dx.doi.org/10.4028/www.scientific.net/msf.727-728.227	Structural Evaluation of Mechanically Alloyed and Heat-Treated Ti-25at-%Si Powders	Materials Science Forum (Online)	Souza, M. A. ; RAMOS, Erika Coaglia Trindade ; RAMOS, A. S.	B3	
artigoEmPeriodico	Alfeu Saraiva Ramos	2012		http://dx.doi.org/10.1590/s1516-14392012005000130	On Ti-18Si-6B and Ti-7.5Si-22.5B powder alloys prepared by high-energy ball milling and sintering. Materials Research (São Carlos	Impresso)	FERNANDES, Bruno Bacci ; RAMOS, A. S. ; MOURA NETO, C. ; COELHO, G. C ; SUZUKI, Paulo A	Qualis nao identificado	IMPRESSO)
artigoEmPeriodico	Alfeu Saraiva Ramos	2011		http://dx.doi.org/10.1016/j.intermet.2011.01.011	Modification of surface properties of Ti-16Si-4B powder alloy by plasma immersion ion implantation	Intermetallics (Barking)	FERNANDES, B. B. ; Ueda, M. ; FERNANDES, P. B. ; Reuther, H. ; RAMOS, A. S.	A3	
artigoEmPeriodico	Alfeu Saraiva Ramos	2011		http://dx.doi.org/10.1109/TPS.2011.2159031	Surface Corrosion of Ti?16Si?4B Powder Alloy Implanted With Nitrogen by Plasma-Based Technique	IEEE Transactions on Plasma Science	FERNANDES, B. B. ; Ueda, M. ; da Silva Savonov, G. ; M. NETO, C. ; RAMOS, A. S.	B1	
artigoEmPeriodico	Alfeu Saraiva Ramos	2011		http://dx.doi.org/10.1590/s1415-47572010005000118	Assessment of the genetic risks of a metallic alloy used in medical implants	Genetics and Molecular Biology (Impresso)	GOMES, CRISTIANO C. ; MOREIRA, LEONARDO M. ; SANTOS, VANESSA J.S.V. ; RAMOS, ALFEU S. ; LYON, JULIANA P. ; SOARES, CRISTINA P. ; SANTOS, FABIO V.	A3	
artigoEmPeriodico	Alfeu Saraiva Ramos	2011			PROPOSTA DE ASSENTO PARA CRIANÇAS COM DISFUNÇÃO NEUROMOTORA NA EQUOTERAPIA: UMA INTERVENÇÃO DA TECNOLOGIA ASSISTIVA	Cadernos de Terapia Ocupacional da UFSCar	ARAUJO, J. C. ; SANTO, A. M. E. ; RAMOS, A S	Qualis nao identificado	CADERNOS DE TERAPIA OCUPACIONAL DA UFSCAR
artigoEmPeriodico	Alfeu Saraiva Ramos	2010		http://dx.doi.org/10.1016/j.jallcom.2009.11.011	Obtaining and stability verification of superconducting phases of the Nb-Al and Nb-Sn systems by mechanical alloying and low temperature heat treatments	Journal of Alloys and Compounds	F. A. Santos ; RAMOS, A. S. ; C. Santos ; RODRIGUES JR, D.	A1	
artigoEmPeriodico	Alfeu Saraiva Ramos	2010		http://dx.doi.org/10.1016/j.jallcom.2009.11.137	Preparation of 50Ni-45Ti-5Zr powders by high-energy ball milling and hot pressing	Journal of Alloys and Compounds	Julia Marinzeck de Alcântara Abdala ; FERNANDES, Bruno Bacci ; Dalcy Roberto dos Santos ; Vinícius André Rodrigues Henriques ; MOURA NETO, C. ; RAMOS, A. S.	A1	
artigoEmPeriodico	Alfeu Saraiva Ramos	2010		http://dx.doi.org/10.4028/www.scientific.net/msf.660-661.701	102213 Use of High Energy Ball Milling on the Sintering Optimization of Alumina Ceramics	Materials Science Forum (Online)	SIMONI, H. R. ; Eduardo Saito ; SANTOS, C. ; SANTOS, Felipe Antunes ; RAMOS, A. S. ; SILVA, Olivério M M	B3	
artigoEmPeriodico	Alfeu Saraiva Ramos	2010		http://dx.doi.org/10.4028/www.scientific.net/msf.660-661.82	Efficiency Evaluation of ZrB2 Incorporation in the MgB2 Matrix Phase Using High-Energy Milling	Materials Science Forum (Online)	SANTOS, Felipe Antunes ; RAMOS, A. S. ; SANTOS, C. ; SUZUKI, Paulo A ; RODRIGUES JR, D.	B3	
artigoEmPeriodico	Alfeu Saraiva Ramos	2009		http://dx.doi.org/10.1016/j.msec.2008.08.022	Osseointegration Features of Orthopedic Ti-10Si-5B implants. Materials Science & Engineering	C, Biomimetic Materials, Sensors and Systems (Print)	M. K. N. Kato ; ONARI, Erick ; E. A. L. Arisawa ; Silva, N. S. ; RAMOS, A. S.	Qualis nao identificado	C, BIOMIMETIC MATERIALS, SENSORS AND SYSTEMS
artigoEmPeriodico	Alfeu Saraiva Ramos	2009		http://dx.doi.org/10.1016/j.msea.2008.10.051	Properties of Y-TZP/Al2O3 ceramic nanocomposites obtained by high-energy ball milling. Materials Science & Engineering	A, Structural Materials: Properties, Microstructure and Processing	SANTOS, C. ; KOIZUMI, M. H. ; DAGUANO, J. K. M. F. ; SANTOS, Felipe Antunes ; ELIAS, C. N. ; RAMOS, A. S.	A1	MATERIALS SCIENCE & ENGINEERING. A, STRUCTURAL MATERIALS: PROPERTIES, MICROSTRUCTURE AND PROCESSING
artigoEmPeriodico	Alfeu Saraiva Ramos	2009		http://dx.doi.org/10.1016/j.jallcom.2008.06.164	Effect of Composition and Milling Parameters on the Critical Ball Milling of Ti-Si-B Powders	Journal of Alloys and Compounds	RAMOS, E. C. T. ; D.R. dos Santos ; CAIRO, C A A ; HENRIQUES, Vinícius A R ; RAMOS, A. S.	A1	
artigoEmPeriodico	Alfeu Saraiva Ramos	2009		http://dx.doi.org/10.1088/1742-6596/167/1/012056	Polyurethane coating with thin polymer films produced by plasma polymerization of diglyme. Journal of Physics	Conference Series (Online)	RIBEIRO, M A ; RAMOS, A S ; MANFREDINI, M I ; ALVES, H A ; HONDA, R Y ; KOSTOV, K G ; LUCENA, E F ; RAMOS, E C T ; MOTA, R P ; ALGATTI, M A ; KAYAMA, M E	Qualis nao identificado	CONFERENCE SERIES
artigoEmPeriodico	Alfeu Saraiva Ramos	2008		http://dx.doi.org/10.4028/www.scientific.net/msf.591-593.135	Effect of Milling Parameters on the TiB and TiB2 Formation in Ti-50at%B and Ti-66at%B Powders	Materials Science Forum (Online)	SILVA, G. ; RAMOS, E. C. T. ; RAMOS, A. S.	B3	
artigoEmPeriodico	Alfeu Saraiva Ramos	2008		http://dx.doi.org/10.4028/www.scientific.net/msf.591-593.141	Structural Evaluation of Mechanically Alloyed Ti-Nb Powders	Materials Science Forum (Online)	GIFFONI, Y. A. ; RAMOS, E. C. T. ; SANDIM, H. R. Z. ; PACHECO, Marcos Tadeu Tavares ; SILVA, G. ; RAMOS, A. S.	B3	
artigoEmPeriodico	Alfeu Saraiva Ramos	2008		http://dx.doi.org/10.4028/www.scientific.net/msf.591-593.147	Structural Evaluation of Ti-22.2Si-11.1B Powders Milled with PCA Addition	Materials Science Forum (Online)	SILVA, G. ; RAMOS, E. C. T. ; Silva, N. S. ; RAMOS, A. S.	B3	
artigoEmPeriodico	Alfeu Saraiva Ramos	2007		http://dx.doi.org/10.1016/j.jallcom.2006.02.057	Synthesis of the Ti6Si2B compound by mechanical alloying	Journal of Alloys and Compounds	SILVA, Gilbert ; RAMOS, Erika Coaglia Trindade ; RAMOS, A. S.	A1	
artigoEmPeriodico	Alfeu Saraiva Ramos	2007		http://dx.doi.org/10.1016/j.jallcom.2006.08.159	On the T2-phase formation in mechanically alloyed Nb-Si and Nb-Si-B powders	Journal of Alloys and Compounds	FERNANDES, B. B. ; RODRIGUES, Geovani ; SILVA, G. ; RAMOS, E. C. T. ; NUNES, C. A. ; SANDIM, H. R. Z. ; RAMOS, A. S.	A1	
artigoEmPeriodico	Alfeu Saraiva Ramos	2007		http://dx.doi.org/10.1016/j.jallcom.2006.08.135	Preparation of Nb-25Si, Nb-37.5Si, Nb-66.6Si powders by high-energy ball milling and subsequent heat treatment	Journal of Alloys and Compounds	FERNANDES, Bruno Bacci ; RAMOS, Erika Coaglia Trindade ; SILVA, Gilbert ; RAMOS, A. S.	A1	
artigoEmPeriodico	Alfeu Saraiva Ramos	2007			Estudo das ligas Ti-18Si-6B e Ti-7,5Si-22,5B confeccionadas por moagem de alta energia e prensagem a quente. Tecnologia em Metalurgia e Materiais (São Paulo	Impresso)	FERNANDES, B. B. ; RAMOS, A. S. ; MOURA NETO, C. ; FERNANDES, P. B.	Qualis nao identificado	IMPRESSO)
artigoEmPeriodico	Alfeu Saraiva Ramos	2007		http://dx.doi.org/10.1016/j.jallcom.2005.12.124	Synthesis of the Ti6Si2B compound by mechanical alloying	Journal of Alloys and Compounds	SILVA, Gilbert ; RAMOS, Erika Coaglia Trindade ; RAMOS, ALFEU SARAIVA	A1	
artigoEmPeriodico	Alfeu Saraiva Ramos	2006		http://dx.doi.org/10.1016/j.intermet.2005.08.005	Preparation of Ti+Ti6Si2B powders by high-energy ball milling and subsequent heat treatment	Intermetallics (Barking), http://www.sciencedirect.com	SILVA, Alexandro Nakano ; SILVA, Gilbert ; RAMOS, Erika Coaglia Trindade ; PASCHOAL, André Luis ; FILGUEIRA, Marcello ; RAMOS, A. S.	Qualis nao identificado	INTERMETALLICS , HTTP://WWW.SCIENCEDIRECT.COM
artigoEmPeriodico	Alfeu Saraiva Ramos	2006		http://dx.doi.org/10.1016/j.matchar.2005.09.009	On the peritectoid Ti3Si formation in Ti-Si alloys	Materials Characterization, www.elsevier.nl	RAMOS, A. S.; NUNES, Carlos Angelo ; COELHO, Gilberto Carvalho	Qualis nao identificado	MATERIALS CHARACTERIZATION, WWW.ELSEVIER.NL
artigoEmPeriodico	Alfeu Saraiva Ramos	2006		http://dx.doi.org/10.1016/j.msea.2006.01.096	High-energy ball milling of powder B-C mixtures	Materials Science & Engineering. A, Structural Materials: Properties, Microstructure and Processing	RAMOS, A. S.; Simone P. Taguchi ; RAMOS, E. C. T. ; ARANTES, Vera Lúcia ; RIBEIRO, Sebastião	A1	
